Cond1,Cond2,jaccard_distance,Shared,NotShared_cond1,NotShared_cond2,Total_Genes_Cond1,Total_Genes_Cond2,Genes_Names,Percentage_Shared_Cond1,Percentage_Shared_Cond2,pvalue,-log(p)
"ChAd-BNT (V2, D7)","ZF2001 (V3, D07)",0.217,98,165,189,263,287,"ABL1, ADA, ADGRE5, ADM, ARID5A, B4GALT1, BCL3, BCL6, BMP6, BTNL8, C5AR1, CCL20, CCL3, CCL4, CCR1, CD14, CD151, CD68, CD83, CDC42, CDH26, CEBPB, CLU, CSF1, CTNNB1, CTSS, CXCL1, CXCL2, CXCL3, CXCL5, CXCL8, CXCR4, CXCR5, DNM2, FKBP1A, FOSL1, FPR1, GPLD1, GPR89A, GRB2, IFI30, IFNGR2, IL10RB, IL1RN, IRF1, JMJD6, KHDRBS1, LGALS1, LGALS3, LY86, MAP2K1, MAPKAPK2, METTL3, MS4A1, MTHFD1, NCF2, NFAM1, NFKBIA, NKAP, NLRP9, NRARP, PDE4B, PECAM1, PF4V1, PPP2CA, PPP3CA, PSME1, PTAFR, PTGER4, PTPRJ, PTX3, RAB3B, RAB4A, RELB, RHOA, RNF135, RNF19B, RPL13A, S100A12, SCNN1B, SELP, SLC15A3, SPI1, STXBP1, TFE3, THEMIS2, TICAM1, TNFAIP3, TNFRSF1B, TNFSF15, TNFSF8, TREML1, TTC4, UBE2N, VIM, YY1, ZC3H8, ZFP36L1",37.26,34.15,5.627575298166173e-54,53.24967868533512
"ChAd-BNT (V2, D7)","ChAd (V1, D7)",0.242,94,169,126,263,220,"ADGRE5, AIF1, APOBEC3F, APOBEC3H, ARID5A, B4GALT1, BTNL8, CASP1, CASP3, CAV1, CBL, CCL20, CCL3, CCL3L1, CCL4, CCNB2, CD27, CD38, CD55, CD68, CD83, CD86, CLEC10A, CRK, CSF1, CTSC, CXCL2, CXCL6, CXCR1, CXCR2, CXCR5, DNASE1, DNM2, ENDOD1, EPB42, FCGR3A, FKBP1B, FPR1, FPR2, GPLD1, GPR65, GTPBP1, IFI6, IFNAR1, IFNAR2, IFNGR1, IL1R2, IRF1, ITGAL, KHDRBS1, LILRB2, MTHFD1, MTOR, NFKB1, NFKBIA, NKAP, NLRP6, NRARP, PARP1, PDE4B, PECAM1, PI3, PIK3CA, PIK3CG, PKHD1L1, PPP3CA, PSME1, PTGER4, RAG1, RBPJ, RNF213, RPS6KB1, S1PR1, SARM1, SCNN1B, SFTPD, SLC12A2, SNCA, SOS1, SP3, SPACA3, SRP54, SRPK2, STAT1, SYVN1, TICAM1, TNFAIP3, TNFRSF17, TRIM23, TRIM26, TTLL1, UBA7, VIM, ZNF3",35.74,42.73,8.93468019871806e-42,41.04892098769305
"ChAd-BNT (V2, D7)","ChAd (V2, D3)",0.093,29,234,49,263,78,"CBL, CCNB2, CD300LB, CDH26, CSF1, CXCR5, EIF2B2, EPX, FCGR3A, GPR89A, GPR89B, LFNG, MASP2, METTL3, MYSM1, NFKB2, NKAP, NLRP9, PARP1, PNP, PPP3CA, RAB6A, S1PR1, SYVN1, TNFAIP8L2, VAV2, WFDC3, YY1, ZC3HAV1",11.03,37.18,4.197127334266099e-37,36.37704785477463
"ChAd-BNT (V2, D7)","ChAd (V2, D7)",0.269,110,153,146,263,256,"ADGRE5, ADGRG3, ADM, APOBEC3F, ARID5A, BCL3, BCL6, BMP6, BTNL8, C5AR1, CASP6, CBL, CCL20, CCL3, CCL3L1, CCL4, CCNB2, CCR1, CD300LD, CD55, CD83, CDH26, CEBPB, CSF1, CTNNB1, CTSC, CXCL1, CXCL2, CXCL6, CXCL8, CXCR1, CXCR2, CXCR4, CXCR5, DNASE1, EIF2B2, ENDOD1, EPX, FCAR, FCGR1A, FCGR3A, FKBP1B, FOSL1, FPR2, GPLD1, GPR89A, GPR89B, GTPBP1, HLA-DMB, HLA-DPA1, HLA-E, IFI30, IFI6, IFIT1, IFIT2, IFITM3, IFNAR1, IL15, IL1R2, IRF1, IRF9, ITGAL, JMJD6, LFNG, LILRA5, LILRB2, MASP2, METTL3, MTOR, MYSM1, NFKB2, NFKBIA, NFKBID, NLRP6, NLRP9, NRARP, PDE4B, PDE4D, PF4V1, PI3, PPP2R1A, PPP3CA, PTAFR, PTGER4, PTX3, RAP1GAP, RPS6KA3, SKIL, SLC15A3, SLC15A4, SRC, SYVN1, TESPA1, THEMIS2, TICAM1, TNFAIP3, TNFSF15, TNFSF8, TNFSF9, TRIM26, TRIM59, TTLL1, TXK, TXLNA, VAV2, YY1, ZBTB7A, ZC3H8, ZC3HAV1, ZFP36L1",41.83,42.97,2.073805425446553e-40,39.683231993664904
"ChAd-BNT (V2, D7)","I (D51, hospital)",0.207,87,176,158,263,245,"ADGRE5, ADGRG3, ADM, B4GALT1, BATF2, BCL10, BCL3, BCL6, CASP6, CCL20, CCL7, CCNB2, CCR7, CD300LB, CD55, CD83, CDC42, CEBPB, CLEC10A, CLU, CXCL2, CXCR4, EIF2B2, EPB42, FCAR, FCGR1A, FPR1, GBP2, GPR65, GRB2, GTPBP1, HDAC4, HLA-E, IFI30, IFITM2, IFNGR2, IGF1R, IL1R2, IL1RN, IL27, IRF1, JMJD6, KAT7, KHDRBS1, LGALS3, MAPKAPK2, MEN1, MTOR, NFKB2, NFKBIA, NFKBID, NLRC3, PARP1, PDE4B, PPP2CA, PSME1, PTX3, RAP1GAP, RBPJ, RELB, RNF19B, RNF213, S100A12, S1PR1, SELP, SKIL, SLC15A3, SLC15A4, SNCA, STAT1, TESPA1, THEMIS2, TICAM1, TNFAIP3, TNFAIP8L2, TNFSF8, TNFSF9, TREML1, TRIM58, TRPV1, TXLNA, UBE2N, USP27X, VIM, ZC3H8, ZC3HAV1, ZNF3",33.08,35.51,3.887959589346391e-52,51.41027825768997
"ChAd-BNT (V2, D7)","ZF2001 (V3, D14)",0.142,54,209,117,263,171,"ADA, ADM, APOBEC3F, ARID5A, CASP6, CCL3, CRK, CSF1, CTNNB1, CXCL2, CXCL8, FKBP1A, GPLD1, GPR89A, IFNAR1, IL10RB, IL1RN, KHDRBS1, METTL3, MSH2, MTHFD1, NFKBIA, NKAP, NLRP9, PDE4D, PECAM1, PIK3CG, PIK3R1, PPP2CA, PPP2R1A, PPP3CA, PSME1, PTAFR, PTX3, RAB3B, RAB4A, RNF19B, RPL13A, RPS6KA3, RPS6KB1, SLC15A3, SOS1, SRPK2, STAT1, TICAM1, TNFAIP8L2, TNFRSF17, TREML4, TRIM23, TXLNA, UBE2N, USP27X, VIM, YY1",20.53,31.58,3.9231783306237074e-56,55.40636195028352
"ChAd-BNT (V2, D7)","ChAd (V1, D3)",0.297,142,121,215,263,357,"ADA, ADARB1, ADGRE5, ADGRG3, AIF1, APOBEC3F, APOBEC3H, ARG2, ASXL1, ATF2, B2M, BATF2, BMP6, CASP1, CCL20, CCL3, CCL3L1, CCNB2, CCR1, CD14, CD151, CD38, CD68, CD86, CDC42, CEBPB, CRK, CSF1, CTSC, CTSS, CXCL1, CXCL3, CXCL5, CXCL6, CXCL8, CXCR5, DNASE1, EIF2B2, EPX, FCER1G, FCGR1A, FCGR3A, FKBP1A, FOSL1, FPR1, FPR2, GBP2, GPLD1, GPR89B, GRB2, HCK, HLA-DMB, HLA-DPA1, HLA-E, IFI30, IFI6, IFITM3, IFNAR1, IFNAR2, IFNGR2, IGF1R, IGSF6, IL10RB, IL12B, IL15, IL1R2, IL27, IRF9, ITGA4, ITGAL, ITGB7, JAGN1, KHDRBS1, LEPR, LFNG, LGALS1, LGALS3, LILRA2, LILRA5, LILRB2, LTBR, LY86, MAP2K1, MASP2, METTL3, MPL, MS4A1, MTHFD1, MTOR, MYSM1, NCF2, NCKAP1L, NFAM1, NLRC3, NLRP6, NRARP, OTUD4, PBX1, PDIA3, PECAM1, PI3, PIK3CA, PIK3R1, PLCG1, PNP, PPP2R1A, PSEN1, PSME1, PTPRJ, RAP1GAP, RBX1, RHOA, RNF135, RNF213, RPL13A, RPS6KB1, SARM1, SKIL, SLC12A2, SLC15A3, SNCA, SPI1, SRC, SRP54, SRPK2, STAT1, TLR4, TNFAIP8L2, TNFRSF1B, TNFSF15, TNFSF4, TRIM21, TRIM23, TRIM26, TTC4, TXLNA, VIM, VSTM1, WFDC3, YY1, ZBTB7A, ZNF3",53.99,39.78,2.959378396367801e-39,38.52879950089283
"ChAd-BNT (V2, D7)","BNT-I (D51, hospital)",0.116,41,222,90,263,131,"CCL3, CCNB2, CCR1, CD300LB, CRK, CXCL1, CXCR2, EGR1, FCGR2A, FPR2, HCK, IFNAR2, IGSF6, LGALS4, LILRA5, LILRB2, MASP2, MPL, NCF2, OTUD4, PSEN1, RAB3B, RAB6A, RAG1, S1PR1, SOS1, SRP54, TLR4, TNFAIP3, TNFAIP8L2, TNFRSF1B, TNFSF15, TNFSF8, TREML1, TRIM21, TRIM40, TRIM59, TXLNA, VNN1, WFDC3, ZFP36L1",15.59,31.3,3.2363490476815207e-52,51.48994464487588
"ChAd-BNT (V2, D7)","BNT-MO (V3, D1)",0.007,2,261,32,263,34,"STXBP1, VAV2",0.76,5.88,7.807409554565424e-41,40.107493038180785
"ChAd-BNT (V2, D7)",I (D0-4),0.186,89,174,216,263,305,"ADARB1, ADM, APOBEC3F, APOBEC3H, ASXL1, ATF2, BATF2, CASP1, CCL7, CCNB2, CCR1, CCR7, CD38, CD68, CD86, CTSC, CXCL1, CXCL6, CXCR4, EGR1, EIF2B2, EPX, FCER1G, FCGR1A, GPR89B, GTPBP1, IFI30, IFI6, IFIT1, IFIT2, IFITM2, IFITM3, IGF1R, IL10RB, IL15, IL1RN, IL27, IRF9, ITGAL, ITGB7, KAT7, LGALS1, LILRA5, LILRB2, LTBR, LY86, MASP2, METTL3, NCKAP1L, NKAP, PDE4B, PDE4D, PDIA3, PECAM1, PI3, PIK3CA, PIK3R1, PPP3CA, PTAFR, RAB3B, RAB6A, RBX1, RELB, RNF135, RNF168, RNF213, RPL13A, S100A12, SLC12A2, SOS1, SPI1, SRC, SRP54, STAT1, STXBP1, TFE3, TICAM1, TNFRSF1B, TNFSF15, TRIM21, TRIM23, TRIM26, TXLNA, UBA7, VAV2, YY1, ZBTB7A, ZC3HAV1, ZNF3",33.84,29.18,1.647468554725964e-63,62.78318286604462
"ChAd-BNT (V2, D7)",I-I (D0-5),0.125,45,218,98,263,143,"ADARB1, APOBEC3F, ASXL1, BATF2, CASP1, CCNB2, CCR7, CD38, CD68, CD86, CXCR4, CXCR5, EPX, IFI30, IFI6, IFIT1, IFIT2, IFITM3, IGF1R, IL12B, IL15, IL1RN, IRF9, LGALS1, LILRB2, LY86, MASP2, NFKBID, PI3, PIK3R1, RAG1, RNF135, RNF213, RPL13A, SOS1, SRC, STAT1, TICAM1, TNFSF15, TRIM21, TRIM23, UBA7, ZBTB7A, ZC3HAV1, ZNF3",17.11,31.47,1.543563296627769e-53,52.811475556779534
"ChAd-BNT (V2, D7)","BNT (V2, D1)",0.067,22,241,67,263,89,"APOBEC3F, APOBEC3H, BATF2, CCL4, CD300LB, CLEC10A, CRTAM, CXCL1, CXCL3, CXCL6, CXCL8, EGR1, FCGR1A, GBP2, IFNGR1, IRF1, ITGAL, SRP54, TTC4, TXLNA, VIM, VNN1",8.37,24.72,3.5823458523177835e-51,50.445832488140134
"ChAd-BNT (V2, D7)","BNT (V3, D1)",0.015,4,259,9,263,13,"CD300LD, GPLD1, GPR89A, LGALS3",1.52,30.77,3.6394632867823814e-14,13.438962657223193
"ChAd-BNT (V2, D7)",I-BNT (D5),0.18,57,206,54,263,111,"ADGRG3, BMP6, C5AR1, CCR1, CD14, CD300LB, CD38, CRK, CTSS, CXCL1, CXCL6, CXCR1, CXCR2, EPB42, EPX, FCAR, FCGR2A, FPR1, FPR2, GPLD1, GPR65, HCK, IFNAR1, IFNAR2, IFNGR1, IFNGR2, IGSF6, LGALS4, LILRA2, LTBR, METTL3, NCF2, NFAM1, NFKB1, NFKBID, PDE4B, PECAM1, PF4V1, PIK3CG, PPP3CA, PSEN1, PTAFR, PTPRJ, SARM1, SELP, SPI1, SRP54, STAT3, TFE3, THEMIS2, TLR4, TNFAIP8L2, TNFRSF1B, TNFSF8, TREML4, TRIM23, ZNF3",21.67,51.35,4.596703239172026e-30,29.337553533175992
"ChAd-BNT (V2, D7)","BBIBP (V3, D07)",0.101,29,234,25,263,54,"ADM, B4GALT1, BCL3, BCL6, CCL3, CD83, CDC42, CSF1, CXCL5, CXCL8, CXCR4, FOSL1, HDAC4, JMJD6, MAPKAPK2, NFKBIA, PDE4B, PNP, PPP2CA, PTGER4, PTX3, RELB, RNF19B, SRP54, TICAM1, TNFAIP3, TNFSF9, TRIM23, VIM",11.03,53.7,2.49896516808705e-21,20.60223979726011
"ChAd-BNT (V2, D7)","BBIBP (V3, D14)",0.121,39,224,60,263,99,"ADM, B2M, B4GALT1, BCL3, BCL6, CCL20, CCL3, CD83, CSF1, CTNNB1, CXCL2, CXCL8, EPB42, IL1RN, IRF1, JMJD6, LGALS3, MTHFD1, NFKB2, NFKBIA, NFKBID, NKAP, NLRP9, PBX1, PDE4B, PPP2CA, PSME1, PTGER4, PTX3, RAB3B, RAP1GAP, RNF19B, RPL13A, SNCA, TICAM1, TNFAIP3, TRIM58, UBE2N, VIM",14.83,39.39,4.461047084495848e-39,38.35056319293663
"ChAd-BNT (V2, D7)","BBIBP (V3, D28)",0.143,43,220,38,263,81,"ADM, B4GALT1, BCL3, BCL6, BMP6, CCL20, CCL3, CD83, CLU, CSF1, CTNNB1, CXCL2, CXCL5, CXCL8, CXCR2, EPB42, IL1RN, IRF1, JMJD6, LEPR, MPL, NFKB2, NFKBIA, OTUD4, PBX1, PDE4B, PKHD1L1, PPP2CA, PSME1, PTGER4, PTPRJ, PTX3, RAP1GAP, RNF19B, SELP, SNCA, TICAM1, TNFAIP3, TREML1, TRIM23, TRIM58, VIM, ZFP36L1",16.35,53.09,7.174886922774951e-26,25.14418493908203
"ChAd-BNT (V2, D7)","BNT (V1, D6)",0.031,9,254,26,263,35,"CAV1, CCL4, CXCL3, CXCL5, GPR89A, ITGAL, MASP2, TNFRSF17, TNFSF4",3.42,25.71,9.430892055899011e-30,29.0254472259656
"ChAd-BNT (V2, D7)","ChAd (V1, D6)",0.018,5,258,15,263,20,"CD14, CXCL5, IFNGR1, LILRA2, S100A12",1.9,25,6.504772143246634e-21,20.18676791181013
"ChAd-BNT (V2, D7)","ZF2001 (V3, D28)",0.093,30,233,58,263,88,"ARID5A, ATF2, CCL20, CCL3, CD27, CSF1, CXCL2, CXCL8, CXCR1, GTPBP1, IRF9, METTL3, NFKBIA, NLRC3, NLRP9, NRARP, PPP2CA, PSME1, PTGER4, PTX3, RAB4A, RBPJ, RPS6KA3, SOS1, TICAM1, TNFAIP3, TNFRSF17, UBA7, UBE2N, USP27X",11.41,34.09,7.091201434046636e-42,41.14928017779675
"ChAd-BNT (V2, D7)","ChAd-BNT (V3, D1)",0.008,2,261,2,263,4,"CCL3L1, CD300LB",0.76,50,1.7152658662092615e-4,3.7656685547590145
"ChAd-BNT (V2, D7)","ChAd (V2, D1)",0.015,4,259,5,263,9,"FOSL1, PDE4D, TNFSF9, TREML4",1.52,44.44,1.1354664286406051e-8,7.9448257016658825
"I (D10, hospital)",BNT-I (D0-5),0.251,146,236,199,382,345,"ABL1, ACE, ADM, AKT1, ALOX5, ANKHD1, ANXA3, APBB1IP, APOBEC3A, BATF2, BCL2, BCL3, BCL6, BPI, BST1, BTN2A1, C1R, CACNB3, CAMP, CCNB2, CCR7, CD177, CD1C, CD27, CD28, CD300LB, CD3G, CD7, CD8B, CDC42, CDK6, CDKN2B, CEACAM8, CFB, CHGA, CIITA, CRIP1, CX3CR1, CXCR4, DDX60, DEFA4, DNASE1, EDNRB, EFNB1, EIF2AK2, EPHB2, ERCC1, ETS1, F2, FCER1A, FGR, FPR1, FPR3, GAPT, GATA3, GBP2, GBP6, GPR15, GPR183, HLA-C, HLA-DPA1, HLA-E, HMGB1, HMSD, HRH2, IDO1, IFI27, IFI6, IFIT1, IFITM2, IL10, IL10RB, IL17RC, IL1RN, IL2RB, IL7R, IMPDH2, IRAK1BP1, ITGA3, ITGA6, ITGAM, ITK, JAG1, KIF5B, LCN2, LILRA6, LILRB1, LMBR1L, LRP1, MAP2K6, MAPK1, MEN1, MX1, MYO1C, MYO1G, MYSM1, NCAPH2, NCF2, NF1, NFKBIA, NLRP6, NRROS, OAS2, PARP9, PELI3, PIK3AP1, PIK3CA, PIK3R1, PRKCD, PRKCE, PRKCQ, RAB6A, RAP1GAP, RASGRP1, RNASE2, RORA, RPL22, RPS6, RPS6KA3, S100A7, SDHAF4, SHMT2, SLC12A2, SOS2, SP100, SRC, STAT3, STXBP4, TARM1, TBKBP1, TCF3, TFE3, TGFBR3, THEMIS, TNFRSF4, TRIM22, TRIM64B, VAV2, VEGFA, XCL1, XRCC6, ZBTB7A, ZC3HAV1, ZFP36L2, ZFPM1, ZNF3",38.22,42.32,1.3248882006055676e-60,59.87782076769594
"I (D10, hospital)","BNT-I (D10, hospital)",0.595,278,122,67,400,345,"ABL1, ACE, ACTR3, ADAM17, ADAMTS13, ADARB1, ADD2, ADGRG3, ADM, ADORA1, ALOX5, ANKHD1, ANXA3, AP3B1, APBB1IP, APOBEC3A, ATF2, B2M, BATF2, BCL10, BCL2, BCL3, BCL6, BCR, BMX, BPI, BST1, BTN2A1, C1R, CACNB3, CAMLG, CAMP, CASP1, CASP6, CAV1, CCL5, CCNB2, CCND3, CCR7, CD160, CD177, CD1C, CD1E, CD24, CD247, CD28, CD34, CD38, CD3G, CD40LG, CD55, CD58, CD6, CD81, CD8B, CD96, CDC42, CDH26, CDK6, CDKN2B, CEACAM8, CEBPB, CFB, CFH, CH25H, CIITA, CLEC10A, CR1, CRISP3, CRK, CRKL, CRTAM, CRTC3, CTSW, CX3CR1, CXCR3, CXCR4, DBH, DDX60, DEFA4, DENND1B, DPP4, EFNB1, EIF2AK2, EOMES, EPHB2, ERCC1, ETS1, F12, FBXO38, FCAR, FCER1A, FCER1G, FCGR1A, FGR, FKBP1A, FLT1, FLT3, FPR1, GAPT, GATA3, GBP2, GBP6, GPR15, GPR183, GPR89A, GPR89B, GRB2, GZMM, HDAC4, HHEX, HLA-C, HLA-DPA1, HLA-E, HMGB2, HP, HRH2, IFI27, IFI6, IFIT1, IFITM1, IFITM2, IFNGR1, IFNGR2, IFNL1, IL10, IL10RB, IL18BP, IL18RAP, IL1R1, IL1R2, IL1RN, IL23R, IL27, IL27RA, IL2RB, IL32, IL34, IL4R, IL5RA, IL7R, IMPDH2, IPO7, IRAK1BP1, ITGA3, ITGA4, ITGA6, ITGAM, ITGB7, ITGB8, ITK, ITPKB, JAG1, JAK3, JMJD6, KIF5B, KMT2A, LCN2, LCP1, LFNG, LILRA5, LILRA6, LMO4, LRRC8A, LTB, MAP2K6, MAP3K8, MEN1, MFSD6, MS4A2, MX1, MYO1G, NCAPH2, NCF2, NFKBIA, NLRC3, NLRP6, OAS2, OTUD7B, PARP1, PARP9, PELI3, PIK3AP1, PIK3CA, PIK3CG, PIK3R1, PKNOX1, PLCG1, PLCG2, PPARG, PPP2CA, PPP3CA, PRKCD, PRKCE, PRKCQ, PSEN1, PSMB8, PTPN2, PURA, PYHIN1, RAB27A, RAB6A, RAG1, RAP1GAP, RASGRP1, RBPJ, RC3H1, RFPL4A, RHOA, RNASE2, RNASE3, RNASE4, RNF135, RORA, RORC, RPL22, RPS6, RPS6KA3, S100A12, S100A7, S1PR1, SARM1, SCG2, SELL, SFTPD, SKAP1, SKIL, SLC12A2, SLC15A4, SMAD3, SNAP23, SOS2, SP100, SP3, SPIRE1, SPN, ST6GAL1, STAT3, STAT5B, STXBP1, STXBP3, STXBP4, SUSD4, SYK, TARM1, TBKBP1, TCF3, TCF7, TESPA1, TFE3, TGFBR3, THBS1, THEMIS, TLR4, TMEM33, TNFAIP3, TNFRSF17, TNFRSF4, TOX, TRIM22, TRIM64B, TRIM65, TRIM68, TTLL1, VAMP2, VAV2, VEGFA, VIM, VNN1, XCL1, ZAP70, ZBTB46, ZBTB7A, ZC3H8, ZC3HAV1, ZFPM1, ZNF3, ZNF683",69.5,80.58,4.82253548569839e-10,9.316724568000035
"I (D10, hospital)","BNT-I (D26, hospital)",0.452,187,69,158,256,345,"ABL1, ACE, ACTR3, ADAM17, ADARB1, ADD2, ADGRG3, ADM, ADORA1, ALOX5, ANKHD1, ANXA3, APBB1IP, APOBEC3A, ATF2, B2M, BCL10, BCL2, BCL3, BCL6, BMX, BPI, BST1, C1R, CACNB3, CAMLG, CAMP, CASP1, CASP6, CCL5, CCNB2, CCR7, CD160, CD177, CD1C, CD1E, CD24, CD27, CD3G, CD40LG, CD55, CD58, CD6, CD81, CDC42, CDH26, CEACAM8, CEBPB, CFH, CH25H, CIITA, CLEC10A, CR1, CRISP3, CRTAM, CX3CR1, CXCR3, DEFA4, DNASE1, EDNRB, EFNB1, EOMES, ETS1, F12, FBXO38, FCAR, FCER1A, FCER1G, FCGR1A, FKBP1A, FPR1, FPR3, GBP2, GBP6, GPR89B, GRB2, HDAC4, HLA-C, HLA-DPA1, HLA-E, HMGB2, HP, IFI27, IFITM1, IFITM2, IFNGR1, IFNGR2, IGF1R, IL10RB, IL18BP, IL18RAP, IL1R1, IL1R2, IL1RN, IL27, IL27RA, IL2RB, IL7R, IMPDH2, IPO7, IRAK1BP1, ITGA3, ITGAM, ITGB7, JAG1, JAK3, JMJD6, KMT2A, LCN2, LCP1, LFNG, LILRA5, LILRA6, LMBR1L, LRRC8A, MAP2K6, MAP3K8, MAPK1, MAPKAPK2, MEN1, MFSD6, MYO1C, MYO1G, NCF2, NFKBIA, NLRC3, NOS2, OTUD7B, PARP1, PIK3CG, PLCG2, PPARG, PPP2CA, PPP2R1A, PRDX2, PSMB8, PURA, PYHIN1, RAG1, RAP1GAP, RBPJ, RC3H1, RFPL4A, RHOA, RNASE4, RNF135, RORC, RPL22, RPS6KA3, S100A12, S100A7, S1PR1, SELL, SHMT2, SLC15A4, SLC18A2, SMAD3, SNAP23, SOS2, SP3, SPIRE1, SPN, ST6GAL1, STAT3, STAT5B, STXBP4, SYK, TARM1, TAX1BP1, TBKBP1, TCF3, TFE3, TGFBR3, THEMIS, TNFAIP3, TOX, TRIM64B, TRIM65, TRIM68, VAMP2, VAV2, VIM, ZAP70, ZC3H8, ZC3HAV1, ZFPM1, ZNF683",73.05,54.2,7.561690273439498e-17,16.121381115295474
"I (D10, hospital)","ChAd-BNT (V2, D3)",0.239,124,174,221,298,345,"ABL1, ADA, ADAM17, ADGRG3, B4GALT1, BATF2, BST1, CASP1, CASP6, CCL5, CCNB2, CCR7, CD247, CD28, CD34, CD38, CD55, CD58, CD81, CDK6, CEBPB, CFB, CIITA, CRTAM, CTSW, CX3CR1, CXCL5, CXCR4, DDX60, DPP8, EFNB1, EIF2AK2, EOMES, EPHB2, FCER1G, FCGR1A, FGR, FPR3, GBP2, GPR183, GPR89A, GPR89B, HHEX, HLA-DPA1, IDO1, IFI27, IFI6, IFIT1, IFNGR1, IGF1R, IL17RC, IL1R1, IL1R2, IL1RN, IL27, IL27RA, IL34, IL7R, IMPDH2, IPO7, ITGA4, ITK, JMJD6, KMT2A, LCP1, LFNG, LILRB1, LRP1, LRRC8A, MAPKAPK2, MFSD6, MX1, MYSM1, NCAPH2, NCF2, NDST2, NLRP6, NLRP9, NRROS, OAS2, PARP9, PELI3, PIK3AP1, PIK3CA, PIK3R1, PPP2CA, PPP2R1A, PPP3CA, PRKCQ, PRKDC, PSMB8, PTPN2, PTPRC, RAB43, RAB6A, RAP1GAP, RNASE2, RNF135, RPL22, RPS6, RPS6KA3, RPS6KB1, S1PR1, SARM1, SELL, SLC12A2, SNAP23, SP100, SP3, SRP54, ST6GAL1, SYK, TNFAIP3, TNFRSF4, TOX, TRIM22, TRIM65, VAMP2, XCL1, ZBTB7A, ZC3H8, ZC3HAV1, ZFP36L2, ZNF3",41.61,35.94,1.7426802328996802e-56,55.75878229494818
"I (D10, hospital)","ChAd-BNT (V2, D7)",0.231,114,149,231,263,345,"ABL1, ADA, ADARB1, ADGRG3, ADM, ATF2, B2M, B4GALT1, BATF2, BCL10, BCL3, BCL6, CASP1, CASP6, CAV1, CCL20, CCNB2, CCR7, CD27, CD300LB, CD38, CD55, CDC42, CDH26, CEBPB, CLEC10A, CRK, CRTAM, CXCL5, CXCR4, DNASE1, FCAR, FCER1G, FCGR1A, FKBP1A, FPR1, GBP2, GPR89A, GPR89B, GRB2, HDAC4, HLA-DPA1, HLA-E, IFI6, IFIT1, IFITM2, IFNGR1, IFNGR2, IGF1R, IL10RB, IL1R2, IL1RN, IL27, ITGA4, ITGB7, JMJD6, LFNG, LILRA5, MAP2K1, MAPKAPK2, MEN1, MYSM1, NCF2, NFKBIA, NLRC3, NLRP6, NLRP9, PARP1, PIK3CA, PIK3CG, PIK3R1, PLCG1, PPP2CA, PPP2R1A, PPP3CA, PSEN1, PTX3, RAB6A, RAG1, RAP1GAP, RBPJ, RHOA, RNF135, RPS6KA3, RPS6KB1, S100A12, S1PR1, SARM1, SFTPD, SKIL, SLC12A2, SLC15A4, SP3, SPIRE1, SRC, SRP54, STAT3, STXBP1, TESPA1, TFE3, TLR4, TMEM33, TNFAIP3, TNFRSF17, TNFSF8, TREML4, TTLL1, VAV2, VIM, VNN1, ZBTB7A, ZC3H8, ZC3HAV1, ZNF3",43.35,33.04,8.328330937787722e-54,53.07944202586069
"I (D10, hospital)","I (D26, hospital)",0.603,240,105,53,345,293,"ABL1, ACE, ACTR3, ADA, ADAM17, ADAMTS13, ADARB1, ADD2, ALOX5, ANKHD1, ANXA3, AP3B1, APBB1IP, ATF2, B2M, BCL10, BCL3, BCL6, BCR, BMI1, BMX, BPI, BST1, C1R, CACNB3, CAMP, CASP6, CAV1, CCL5, CCNB2, CCND3, CCR7, CD160, CD177, CD1E, CD24, CD247, CD27, CD28, CD38, CD3G, CD40LG, CD55, CD58, CD6, CD7, CD81, CD8B, CD96, CDC42, CDH26, CDKN2B, CEACAM8, CEBPB, CFH, CH25H, CIITA, CLEC10A, CR1, CRIP1, CRISP3, CRK, CRTAM, CTSK, CTSW, CX3CR1, CXCR3, CXCR4, DBH, DEFA4, DNASE1, DPP8, DTX1, EDNRB, EFNB1, EOMES, ERCC1, ETS1, F12, FAM3A, FBXO38, FCAR, FCER1A, FCER1G, FCGR1A, FKBP1A, FLT1, FLT3, FPR1, GATA3, GPR89A, GPR89B, GZMM, HDAC4, HLA-DPA1, HMGB1, HMGB2, HP, IFI27, IFNGR1, IFNGR2, IGF1R, IL10, IL10RB, IL17RC, IL18BP, IL18RAP, IL1R1, IL1R2, IL27RA, IL2RB, IL32, IL4R, IL7R, IMPDH2, ITGA3, ITGA4, ITGA6, ITGAM, ITGB7, ITGB8, ITK, ITPKB, JAK3, JMJD6, KIF5B, KMT2A, LCN2, LCP1, LFNG, LILRA6, LRRC8A, LTB, MAP2K6, MAP3K8, MAPK1, MAPKAPK2, MEN1, MFSD6, MS4A2, MYO1G, NCF2, NFKBIA, NLRC3, NRROS, OTUD7B, PARP1, PIK3CG, PIK3R1, PLCG1, PLCG2, PPARG, PPP2CA, PPP2R1A, PPP3CA, PRDX2, PRKCE, PRKCQ, PSEN1, PTPN2, PTPRC, PTX3, PURA, PYHIN1, RAB27A, RAB43, RAB6A, RAG1, RAP1GAP, RASGRP1, RBPJ, RC3H1, RFPL4A, RHOA, RNASE2, RNASE3, RNASE4, RNF135, RORA, RORC, RPL22, RPS6KA3, S100A12, S1PR1, SARM1, SELL, SFTPD, SHMT2, SKAP1, SKIL, SLC11A1, SLC15A4, SLC18A2, SMAD3, SNAP23, SOS2, SP100, SP3, SPIRE1, SPN, SRC, ST6GAL1, STAT3, STAT5B, STXBP1, STXBP3, STXBP4, SUSD4, SYK, TARM1, TAX1BP1, TCF3, TCF7, TESPA1, TGFBR3, THBS1, THEMIS, TMEM229B, TMEM33, TNFAIP3, TNFRSF17, TNFRSF4, TOX, TRIM22, TRIM64B, TRIM65, TRIM68, TTLL1, VEGFA, VIM, VNN1, XCL1, ZAP70, ZBTB46, ZBTB7A, ZC3H8, ZFP36L2, ZFPM1, ZNF3, ZNF683",69.57,81.91,3.932719961471052e-8,7.4053069774442655
"I (D10, hospital)","ZF2001 (V3, D07)",0.158,86,259,201,345,287,"ABL1, ADA, ADM, APOBEC3A, B4GALT1, BCL2, BCL3, BCL6, BCR, BMX, BST1, C1R, CACNB3, CAMLG, CCL20, CCND3, CD177, CD28, CD81, CDC42, CDH26, CEBPB, CRKL, CRTC3, CXCL5, CXCR4, EPHB3, ERCC1, F2, FBXO38, FKBP1A, FLT1, FPR1, GPR183, GPR89A, GRB2, GZMM, IFNGR2, IFNL1, IL10RB, IL1RN, IL34, IMPDH2, IRAK1BP1, ITGB8, ITPKB, JAK3, JMJD6, LCP1, LRRC8A, MAP2K1, MAP3K8, MAPKAPK2, MS4A2, NCF2, NFKBIA, NLRP9, NRROS, PLCG2, PPP2CA, PPP3CA, PRDX2, PTX3, RAB43, RAB5B, RHOA, RNF135, S100A12, SCG2, SHMT2, SMAD3, SP100, STAT5B, STXBP1, STXBP4, TCF7, TFE3, THBS1, TNFAIP3, TNFSF8, TYRO3, VAMP2, VIM, XRCC6, ZBTB46, ZC3H8",24.93,29.97,1.8578663098133673e-80,79.7309855406111
"I (D10, hospital)","ChAd (V1, D7)",0.175,84,261,136,345,220,"ANXA3, AP3B1, B4GALT1, BMX, BPI, C1R, CASP1, CAV1, CCL20, CCNB2, CD160, CD177, CD1E, CD24, CD27, CD28, CD38, CD55, CDKN2B, CEACAM8, CIITA, CLEC10A, CRISP3, CRK, CXCR3, DEFA4, DENND1B, DNASE1, EDNRB, EFNB1, ERCC1, FGR, FPR1, HMGB1, HMGB2, IDO1, IFI27, IFI6, IFNGR1, IL17RC, IL1R1, IL1R2, IL27RA, IRF8, ITPKB, KMT2A, LCN2, LILRA4, LILRB1, LRP1, LRRC8A, MAP2K6, NFKBIA, NLRP6, PARP1, PELI3, PIK3AP1, PIK3CA, PIK3CG, PIK3R6, PLCG2, PPP3CA, PRKCE, RAG1, RBPJ, RNASE3, RPS6KB1, S1PR1, SARM1, SDHAF4, SFTPD, SHMT2, SLC12A2, SP3, SPN, SRP54, TAX1BP1, TMEM229B, TNFAIP3, TNFRSF17, TTLL1, VIM, XRCC6, ZNF3",24.35,38.18,1.8450487390510508e-61,60.733992156973024
"I (D10, hospital)","ChAd (V2, D3)",0.087,34,311,44,345,78,"ADORA1, CAMLG, CCNB2, CD247, CD300LB, CDH26, CDK6, CFH, CRTC3, CX3CR1, EOMES, F2, GPR89A, GPR89B, ITGB8, LFNG, MYSM1, NLRP9, OTUD7B, PARP1, PPP3CA, PYHIN1, RAB43, RAB6A, RORC, S1PR1, SPN, ST6GAL1, STXBP4, TARM1, TMEM229B, TRIM65, VAV2, ZC3HAV1",9.86,43.59,5.295936156130675e-37,36.27605725906822
"I (D10, hospital)","ChAd (V2, D7)",0.212,105,240,151,345,256,"ACTR3, ADGRG3, ADM, ADORA1, AKT1, AP3B1, APBB1IP, BCL3, BCL6, C1R, CASP6, CCL20, CCNB2, CD247, CD40LG, CD55, CDH26, CDK6, CEBPB, CFH, CRTC3, CTSK, CX3CR1, CXCR4, DNASE1, F12, F2, FCAR, FCER1A, FCGR1A, FGR, FPR3, GATA3, GPR89A, GPR89B, HLA-C, HLA-DPA1, HLA-E, HMGB1, HMGB2, IDO1, IFI27, IFI6, IFIT1, IL10, IL1R2, IL5RA, IL7R, IMPDH2, IRF8, ITGA6, ITGB8, ITK, JMJD6, KMT2A, LFNG, LILRA5, LILRB1, MS4A2, MX1, MYO1C, MYO1G, MYSM1, NCAPH2, NFKBIA, NLRP6, NLRP9, OTUD7B, PPP2R1A, PPP3CA, PRKDC, PTX3, PYHIN1, RAP1GAP, RFPL4A, RPL22, RPS6, RPS6KA3, SKIL, SLC11A1, SLC15A4, SPN, SRC, STAT5B, STXBP4, TARM1, TBKBP1, TCF7, TESPA1, THBS1, THEMIS, TMEM229B, TNFAIP3, TNFRSF4, TNFSF8, TOX, TTLL1, VAV2, XCL1, ZAP70, ZBTB7A, ZC3H8, ZC3HAV1, ZFPM1, ZNF683",30.43,41.02,9.995873578575853e-58,57.000179245190054
"I (D10, hospital)","I (D51, hospital)",0.332,147,198,98,345,245,"ACTR3, ADAM17, ADGRG3, ADM, ADORA1, ALOX5, ANKHD1, ANXA3, AP3B1, APOBEC3A, B4GALT1, BATF2, BCL10, BCL3, BCL6, BMI1, BMX, BPI, BST1, C1R, CACNB3, CAMLG, CAMP, CASP6, CCL20, CCNB2, CCR7, CD177, CD1E, CD24, CD300LB, CD3G, CD40LG, CD55, CDC42, CEACAM8, CEBPB, CFH, CH25H, CHGA, CLEC10A, CR1, CRISP3, CX3CR1, CXCR3, CXCR4, DEFA4, EIF2AK2, EOMES, ETS1, F12, FCAR, FCGR1A, FLT1, FLT3, FPR1, FPR3, GBP2, GBP6, GRB2, HDAC4, HLA-C, HLA-E, HMGB2, HP, IFITM1, IFITM2, IFNGR2, IGF1R, IL10, IL18RAP, IL1R1, IL1R2, IL1RN, IL20RB, IL27, IL27RA, IL4R, IL7R, IMPDH2, IRF8, ITGA6, ITGAM, ITK, ITPKB, JAG1, JAK3, JMJD6, KIF5B, LCN2, LCP1, LMBR1L, MAP2K6, MAP3K8, MAPKAPK2, MEN1, NDST2, NFKBIA, NLRC3, NOS2, PARP1, PARP9, PIK3AP1, PPARG, PPP2CA, PRKCE, PRKDC, PSMB8, PTPN2, PTX3, PURA, RAP1GAP, RBPJ, RC3H1, RFPL4A, RNASE3, RORC, RPL22, RPS6, S100A12, S1PR1, SDHAF4, SKIL, SLC15A4, SLC18A2, SOS2, SPN, ST6GAL1, STXBP4, TARM1, TAX1BP1, TBKBP1, TESPA1, THBS1, TNFAIP3, TNFSF8, TRIM22, TRIM64B, TRIM65, TRIM68, VAMP2, VIM, XRCC6, ZBTB46, ZC3H8, ZC3HAV1, ZNF3",42.61,60,1.183558011378715e-30,29.926810450532347
"I (D10, hospital)","ZF2001 (V3, D14)",0.117,54,291,117,345,171,"ACTR3, ADA, ADM, ANKHD1, APBB1IP, CAMLG, CASP6, CD24, CDKN2B, CHGA, CRK, CRKL, CX3CR1, EFNB1, FBXO38, FKBP1A, GBP6, GPR89A, IL10RB, IL17RC, IL1RN, IMPDH2, IPO7, ITPKB, LCP1, LMO4, LRRC8A, MAPK1, NFKBIA, NLRP9, PELI3, PIK3CG, PIK3R1, PPP2CA, PPP2R1A, PPP3CA, PRDX2, PRKCD, PTX3, PURA, RAB43, RAB5B, RASGRP1, RORC, RPS6KA3, RPS6KB1, SHMT2, STAT5B, TMEM229B, TNFRSF17, TREML4, TRIM68, TYRO3, VIM",15.65,31.58,9.17328075191293e-68,67.03747531453331
"I (D10, hospital)","ChAd (V1, D3)",0.247,139,206,218,345,357,"ACTR3, ADA, ADAM17, ADAMTS13, ADARB1, ADD2, ADGRG3, APBB1IP, ATF2, B2M, BATF2, BST1, CASP1, CCL20, CCNB2, CCND3, CD1C, CD1E, CD28, CD34, CD38, CD58, CDC42, CEBPB, CFB, CIITA, CRK, CX3CR1, CXCL5, DBH, DDX60, DNASE1, DPP8, DTX1, EDNRB, EFNB1, EIF2AK2, EPHB2, EPHB3, FBXO38, FCER1A, FCER1G, FCGR1A, FGR, FKBP1A, FPR1, FPR3, GAPT, GATA3, GBP2, GBP6, GPR89B, GRB2, HLA-C, HLA-DPA1, HLA-E, HMGB1, IDO1, IFI27, IFI6, IFITM1, IFNGR2, IGF1R, IL10, IL10RB, IL17RC, IL1R1, IL1R2, IL27, IL27RA, IL5RA, IMPDH2, IRAK1BP1, ITGA4, ITGB7, ITGB8, ITK, JAG1, KMT2A, LCP1, LFNG, LILRA5, LILRA6, LILRB1, LMBR1L, MAP2K1, MFSD6, MX1, MYO1G, MYSM1, NCAPH2, NCF2, NLRC3, NLRP6, NRROS, OAS2, PARP9, PIK3AP1, PIK3CA, PIK3R1, PIK3R6, PLCG1, PPARG, PPP2R1A, PRKCD, PSEN1, PSMB8, PTPN2, PTPRC, RAP1GAP, RASGRP1, RHOA, RNASE2, RNF135, RPL22, RPS6, RPS6KB1, SARM1, SELL, SKIL, SLC11A1, SLC12A2, SOS2, SP100, SPN, SRC, SRP54, STXBP4, SYK, TARM1, TLR4, TMEM229B, TRIM22, TRIM65, VIM, XRCC6, ZAP70, ZBTB7A, ZNF3",40.29,38.94,4.530104268696038e-60,59.34389180178448
"I (D10, hospital)","BNT-I (D51, hospital)",0.128,54,291,77,345,131,"ADAMTS13, ADORA1, APBB1IP, BMI1, BST1, BTN2A1, CAMLG, CCNB2, CD28, CD300LB, CD40LG, CDK6, CDKN2B, CFH, CH25H, CRK, CX3CR1, DPP4, EOMES, EPHB3, F2, FGR, HMGB1, HRH2, IL10, IL17RC, IL20RB, ITGA3, LILRA5, NCF2, PRKCD, PSEN1, RAB27A, RAB5B, RAB6A, RAG1, RFPL4A, RNASE2, RORC, S1PR1, SDHAF4, SLC11A1, SPN, SRP54, ST6GAL1, TARM1, TBKBP1, TLR4, TNFAIP3, TNFSF8, TRIM64B, TRIM68, VNN1, ZFP36L2",15.65,41.22,4.239625485190275e-49,48.37267250588345
"I (D10, hospital)","BNT-MO (V3, D1)",0.047,17,328,17,345,34,"ADAMTS13, APOBEC3A, BPI, CAMP, CEACAM8, CRISP3, EDNRB, FLT1, GAPT, HP, LCN2, LMO4, RNASE4, STXBP1, TARM1, TYRO3, VAV2",4.93,50,3.861426183165858e-20,19.41325226292328
"I (D10, hospital)",I (D0-4),0.233,123,222,182,345,305,"ADARB1, ADM, ANXA3, AP3B1, APOBEC3A, ATF2, BATF2, BPI, BST1, CACNB3, CAMP, CASP1, CCL23, CCNB2, CCR7, CD177, CD1C, CD1E, CD28, CD34, CD38, CD58, CD81, CDKN2B, CEACAM8, CFB, CH25H, CRISP3, CTSK, CTSW, CX3CR1, CXCR4, DDX60, EDNRB, EFNB1, EIF2AK2, EPHB2, ETS1, F2, FCER1G, FCGR1A, FGR, FPR3, GAPT, GPR183, GPR89B, HHEX, HMGB1, HP, IDO1, IFI27, IFI6, IFIT1, IFITM1, IFITM2, IGF1R, IL10, IL10RB, IL17RC, IL1RN, IL27, IL2RB, IL34, IL5RA, IMPDH2, IRAK1BP1, ITGA6, ITGAM, ITGB7, LCN2, LILRA5, LILRA6, LILRB1, LMBR1L, LRP1, MAP2K6, MAPK1, MX1, MYO1C, MYO1G, NCAPH2, NF1, NOS2, OAS2, PARP9, PIK3AP1, PIK3CA, PIK3R1, PPARG, PPP3CA, PRKCD, PRKCE, RAB6A, RNASE2, RNASE3, RNF135, RORA, RPL22, RPS6, S100A12, S100A7, SELL, SLC12A2, SP100, SRC, SRP54, STXBP1, STXBP4, SUSD4, TARM1, TBKBP1, TFE3, THEMIS, TMEM229B, TRIM22, TRIM68, VAV2, XCL1, XRCC6, ZBTB7A, ZC3HAV1, ZFP36L2, ZNF3",35.65,40.33,1.1751828886317317e-58,57.92989454076011
