Cond1,Cond2,jaccard_distance,Shared,NotShared_cond1,NotShared_cond2,Total_Genes_Cond1,Total_Genes_Cond2,Genes_Names,Percentage_Shared_Cond1,Percentage_Shared_Cond2,pvalue,-log(p)
BNT-I (D0-5),"BNT-I (D10, hospital)",0.323,191,191,209,382,400,"ABL1, ACE, ADAR, ADM, ALOX5, ANKHD1, ANXA3, APBB1IP, APOBEC3A, ASXL1, AZU1, BATF2, BCL2, BCL3, BCL6, BMPR1A, BPI, BST1, BST2, BTK, BTN2A1, C1R, CACNB3, CAMP, CASP4, CCL4, CCNB2, CCR7, CD177, CD1B, CD1C, CD28, CD3G, CD46, CD8B, CDC42, CDK6, CDKN2B, CEACAM8, CFB, CIITA, CLU, CSF1, CTLA4, CTSG, CX3CR1, CXCR4, DDX60, DEFA4, DEFB1, DOCK8, EFNB1, EIF2AK2, ELANE, ENPP1, EPHB2, EPS8, EPX, ERCC1, ETS1, F2R, FCER1A, FGR, FPR1, FUT7, GAPT, GATA3, GBP1, GBP2, GBP6, GCH1, GPR15, GPR183, GZMA, HCK, HLA-C, HLA-DPA1, HLA-E, HLA-F, HRH2, IFI27, IFI30, IFI35, IFI6, IFIT1, IFIT2, IFITM2, IFITM3, IL10, IL10RB, IL1RN, IL2RB, IL7, IL7R, IMPDH2, IRAK1BP1, IRF9, ITGA1, ITGA3, ITGA6, ITGAM, ITK, JAG1, JAGN1, KIF5B, KLRF2, LAG3, LCN2, LGALS9, LILRA2, LILRA6, MAP2K6, MAPK3, MCOLN2, MEN1, METTL3, MNDA, MTOR, MX1, MX2, MYO1G, NCAPH2, NCF2, NCR3LG1, NFKBIA, NLRC5, NLRP6, OAS2, OLR1, PARP9, PDE12, PELI3, PIK3AP1, PIK3CA, PIK3R1, PML, PRKCD, PRKCE, PRKCQ, PSMB9, PTGDS, PTGER4, PTPN11, RAB10, RAB6A, RAP1GAP, RASGRP1, RELB, RNASE2, RNF19B, RNF213, ROMO1, RORA, RPL22, RPS6, RPS6KA3, S100A7, SLC12A2, SOS2, SP100, SSC5D, STAT1, STAT2, STAT3, STXBP4, TAP1, TARM1, TBKBP1, TCF3, TFE3, TFEB, TGFBR3, THEMIS, TNFRSF4, TNFSF10, TOP2B, TOR2A, TRIM21, TRIM22, TRIM64B, TXK, USP14, VAV1, VAV2, VCAM1, VEGFA, XCL1, ZBTB7A, ZC3HAV1, ZFPM1, ZNF3",50,47.75,5.352862540991779e-47,46.27141390895269
BNT-I (D0-5),"BNT-I (D26, hospital)",0.199,106,276,150,382,256,"ABL1, ACE, ADM, AIF1, ALOX5, ANKHD1, ANXA3, APBB1IP, APOBEC3A, ARHGEF5, BCL2, BCL3, BCL6, BPI, BST1, C1R, CACNB3, CAMP, CCNB2, CCR7, CD177, CD1B, CD1C, CD27, CD3G, CD46, CDC42, CEACAM8, CIITA, CLU, CR2, CX3CR1, DCAF15, DEFA4, DNASE1, EDNRB, EFNB1, ENPP1, EPS8, ETS1, F2R, FCER1A, FPR1, FPR3, GBP2, GBP6, GTPBP1, HLA-C, HLA-DPA1, HLA-E, IFI27, IFITM2, IFITM3, IL10RB, IL1RN, IL2RB, IL7, IL7R, IMPDH2, IRAK1BP1, ITGA3, ITGAM, JAG1, LAG3, LCN2, LILRA6, LMBR1L, MAP2K6, MAPK1, MEN1, MTOR, MYO1C, MYO1G, NCF2, NCR3LG1, NFKBIA, OLR1, PTGDS, RAP1GAP, RELB, RNF19B, RPL22, RPS6KA3, S100A7, SERINC5, SHMT2, SIRT2, SLC15A3, SOS2, SRF, STAT3, STXBP4, TARM1, TBKBP1, TCF3, TFE3, TGFBR3, THEMIS, TOP2B, TOR2A, TRIM64B, TUBB4B, UBA7, VAV2, ZC3HAV1, ZFPM1",27.75,41.41,1.2870494328286834e-62,61.89040477244881
BNT-I (D0-5),"ChAd-BNT (V2, D3)",0.293,154,228,144,382,298,"ABL1, ACTR2, ADAR, AIF1, APOBEC3F, AXL, BATF2, BST1, BST2, BTK, CALM1, CASP3, CASP4, CCL3L1, CCL4, CCL7, CCNB2, CCR7, CD276, CD28, CD300C, CD68, CD86, CDK6, CFB, CFD, CIITA, CLU, CSF1, CTSS, CX3CR1, CXCL1, CXCL12, CXCL6, CXCR4, CYBA, DAPK1, DDX60, DEFB1, DOCK8, EFNB1, EIF2AK2, EIF2B2, EPHB2, EPX, FCGR2C, FGR, FPR3, GBP1, GBP2, GCH1, GPR183, GRN, HAMP, HCK, HK1, HLA-DPA1, HSPD1, IDE, IDO1, IFI27, IFI35, IFI6, IFIT1, IFIT2, IFITM3, IL17RC, IL1RN, IL31RA, IL7R, IMPDH2, IRF9, ITGAL, ITK, KIT, LACC1, LAIR1, LGALS9, LILRB1, LILRB2, LILRB4, LRP1, LTBR, LYL1, MASP2, MCOLN2, METTL3, MLH1, MNDA, MPL, MSN, MTOR, MX1, MX2, MYSM1, NCAPH2, NCF1, NCF2, NLRC5, NLRP6, NOTCH2, NRROS, OAS2, PARP9, PDE4D, PELI3, PIK3AP1, PIK3CA, PIK3R1, PML, PNMA1, POU2F2, PPP3CB, PRDX1, PRKCQ, PTGER4, PTPN11, RAB10, RAB6A, RAP1GAP, RGS1, RNASE2, RNF213, RPL13A, RPL22, RPL30, RPL39, RPS6, RPS6KA3, SIRPA, SLC12A2, SNCA, SOS1, SP100, STAT1, STAT2, TAP1, TAP2, TNFRSF4, TNFSF10, TRIM22, TRIM23, TRIM40, TRIM58, TXK, UBE2N, XBP1, XCL1, XRCC5, YY1, ZBTB7A, ZC3HAV1, ZFP36L2, ZNF3",40.31,51.68,4.4213101861738825e-45,44.35444901519635
BNT-I (D0-5),"ChAd-BNT (V2, D7)",0.21,112,270,151,382,263,"ABL1, ADM, AIF1, APOBEC3F, ASXL1, BATF2, BCL3, BCL6, BTLA, C5AR1, CASP3, CCL3, CCL3L1, CCL4, CCL7, CCNB2, CCR7, CD27, CD300LB, CD68, CD86, CDC42, CLU, CSF1, CTSS, CXCL1, CXCL3, CXCL6, CXCR4, DNASE1, DNM2, EIF2B2, EPB42, EPX, FOSL1, FPR1, FPR2, GBP2, GTPBP1, HCK, HLA-DPA1, HLA-E, IFI30, IFI6, IFIT1, IFIT2, IFITM2, IFITM3, IL10RB, IL1RN, IRF9, ITGAL, JAGN1, KHDRBS1, LGALS1, LILRA2, LILRB2, LTBR, MASP2, MCOLN2, MEN1, METTL3, MPL, MSH2, MTOR, MYSM1, NCF2, NFKBIA, NKAP, NLRP6, PDE4D, PDIA3, PECAM1, PIK3CA, PIK3R1, PTGER4, RAB3B, RAB6A, RAP1GAP, RELB, RNF19B, RNF213, RPL13A, RPS6KA3, SLC12A2, SLC15A3, SNCA, SOS1, SPI1, SRC, STAT1, STAT3, SYVN1, TFE3, TICAM1, TNFRSF1B, TNFSF15, TRIM21, TRIM23, TRIM26, TRIM40, TRIM58, TRIM59, TXK, UBA7, UBE2N, VAV2, YY1, ZBTB7A, ZC3HAV1, ZFP36L1, ZNF3",29.32,42.59,1.1257029113661369e-60,59.94857621070886
BNT-I (D0-5),"I (D10, hospital)",0.251,146,236,199,382,345,"ABL1, ACE, ADM, AKT1, ALOX5, ANKHD1, ANXA3, APBB1IP, APOBEC3A, BATF2, BCL2, BCL3, BCL6, BPI, BST1, BTN2A1, C1R, CACNB3, CAMP, CCNB2, CCR7, CD177, CD1C, CD27, CD28, CD300LB, CD3G, CD7, CD8B, CDC42, CDK6, CDKN2B, CEACAM8, CFB, CHGA, CIITA, CRIP1, CX3CR1, CXCR4, DDX60, DEFA4, DNASE1, EDNRB, EFNB1, EIF2AK2, EPHB2, ERCC1, ETS1, F2, FCER1A, FGR, FPR1, FPR3, GAPT, GATA3, GBP2, GBP6, GPR15, GPR183, HLA-C, HLA-DPA1, HLA-E, HMGB1, HMSD, HRH2, IDO1, IFI27, IFI6, IFIT1, IFITM2, IL10, IL10RB, IL17RC, IL1RN, IL2RB, IL7R, IMPDH2, IRAK1BP1, ITGA3, ITGA6, ITGAM, ITK, JAG1, KIF5B, LCN2, LILRA6, LILRB1, LMBR1L, LRP1, MAP2K6, MAPK1, MEN1, MX1, MYO1C, MYO1G, MYSM1, NCAPH2, NCF2, NF1, NFKBIA, NLRP6, NRROS, OAS2, PARP9, PELI3, PIK3AP1, PIK3CA, PIK3R1, PRKCD, PRKCE, PRKCQ, RAB6A, RAP1GAP, RASGRP1, RNASE2, RORA, RPL22, RPS6, RPS6KA3, S100A7, SDHAF4, SHMT2, SLC12A2, SOS2, SP100, SRC, STAT3, STXBP4, TARM1, TBKBP1, TCF3, TFE3, TGFBR3, THEMIS, TNFRSF4, TRIM22, TRIM64B, VAV2, VEGFA, XCL1, XRCC6, ZBTB7A, ZC3HAV1, ZFP36L2, ZFPM1, ZNF3",38.22,42.32,1.3248882006055676e-60,59.87782076769594
BNT-I (D0-5),"I (D26, hospital)",0.203,114,268,179,382,293,"ABL1, ACE, ALOX5, ANKHD1, ANXA3, APBB1IP, AXL, AZU1, BCL3, BCL6, BPI, BST1, C1R, CACNB3, CAMP, CCNB2, CCR7, CD177, CD27, CD276, CD28, CD3G, CD46, CD7, CD8B, CDC42, CDKN2B, CEACAM8, CIITA, CRIP1, CSK, CTSG, CX3CR1, CXCR4, DEFA4, DNASE1, EDNRB, EFNB1, ELANE, EPS8, ERCC1, ETS1, F2R, FCER1A, FPR1, GATA3, GSDMD, HLA-DPA1, HMGB1, IFI27, IFNE, IL10, IL10RB, IL12RB1, IL17RC, IL2RB, IL7R, IMPDH2, ITGA3, ITGA6, ITGAL, ITGAM, ITK, KIF5B, LAG3, LCN2, LILRA6, MAP2K6, MAPK1, MEN1, MST1R, MTOR, MYO1G, NAGLU, NCF2, NFKBIA, NRROS, OLR1, PIK3R1, PRKCE, PRKCQ, PSMB10, PTGDS, RAB6A, RAP1GAP, RASGRP1, RNASE2, RORA, RPL22, RPS6KA3, SHMT2, SMPD1, SOS2, SP100, SRC, SSC5D, STAT3, STXBP4, TARM1, TCF3, TGFBR3, THEMIS, TNFRSF4, TRIM22, TRIM64B, TXK, UBA7, VEGFA, XCL1, XRCC5, ZBTB7A, ZFP36L2, ZFPM1, ZNF3",29.84,38.91,4.204042709487816e-68,67.37633288055991
BNT-I (D0-5),"ZF2001 (V3, D07)",0.203,113,269,174,382,287,"ABL1, ACTG1, ADM, APOBEC3A, BAX, BCL2, BCL3, BCL6, BSG, BST1, C1R, C5AR1, CACNB3, CACNB4, CCL3, CCL4, CD177, CD276, CD28, CD300C, CD68, CDC42, CFP, CHRNB2, CLU, CNIH1, CORO1A, CSF1, CSF2RB, CSK, CTSG, CTSS, CXADR, CXCL1, CXCL3, CXCR4, CYBA, DHX9, DNM2, ERCC1, F2, FOSL1, FOSL2, FPR1, GCH1, GPR183, GRN, HK1, IFI30, IL10RB, IL11, IL12RB1, IL1RN, IMPDH2, IRAK1BP1, KHDRBS1, LGALS1, LGALS9, LIF, LYL1, MAP2K2, MAP4K2, MAPK3, MDK, METTL3, MST1R, MYH9, NCF1, NCF2, NFKBIA, NKAP, NRROS, PACS1, PECAM1, PLD3, PLEKHM2, PPIB, PPP3CB, PRDX1, PSMA1, PSMB10, PTGER4, RAB3B, RAPGEF3, RELA, RELB, RGS1, RNF19B, RPL13A, RPL30, RPL39, RPS19, SERINC5, SHMT2, SIRPA, SLC15A3, SMPD1, SP100, SPI1, SRF, SSC5D, STXBP4, TAP2, TFE3, TICAM1, TNFRSF1B, TNFSF15, UBE2N, WAS, XBP1, XRCC6, YY1, ZFP36L1",29.58,39.37,6.169810410860887e-67,66.20972818098815
BNT-I (D0-5),"ChAd (V1, D7)",0.216,107,275,113,382,220,"AIF1, AIMP1, ANXA3, APOBEC3F, BPI, BST2, C1R, CASP3, CCL3, CCL3L1, CCL4, CCNB2, CD177, CD27, CD28, CD300C, CD68, CD86, CDKN2B, CEACAM8, CIITA, CSF1, CTLA4, CTSG, CXADR, CXCL6, DEFA4, DHX9, DNASE1, DNM2, DOCK8, EDNRB, EFNB1, EPB42, EPS8, ERCC1, FCGR2C, FGR, FPR1, FPR2, GCH1, GTPBP1, HK1, HMGB1, HSPD1, IDE, IDO1, IFI27, IFI35, IFI6, IL12RB1, IL17RC, IL31RA, IL6ST, IL7, ITGAL, KHDRBS1, LAIR1, LCN2, LGALS9, LIF, LILRB1, LILRB2, LRP1, MAP2K6, MERTK, MTOR, NFKBIA, NKAP, NLRC5, NLRP6, NOTCH2, PAFAH1B1, PECAM1, PELI3, PIK3AP1, PIK3CA, PPIB, PRKCE, PSMA1, PTGER4, PTPN11, RAB10, RELA, RNF213, SDHAF4, SERINC5, SHMT2, SIRT2, SLC12A2, SNCA, SOS1, SSC5D, STAT1, STAT2, SYVN1, TICAM1, TOR2A, TPD52, TRIM23, TRIM26, TUBB4B, UBA7, USP14, XBP1, XRCC6, ZNF3",28.01,48.64,6.421746547174336e-50,49.19234683912077
BNT-I (D0-5),"ChAd (V2, D3)",0.067,29,353,49,382,78,"BMPR1A, CCNB2, CD1B, CD300LB, CDK6, CFD, CHRNB2, CSF1, CX3CR1, EIF2B2, EPX, F2, F2R, IL6ST, LAG3, MASP2, METTL3, MYSM1, NKAP, PTMS, RAB6A, SERINC5, SIRT2, STXBP4, SYVN1, TARM1, VAV2, YY1, ZC3HAV1",7.59,37.18,1.779124939924026e-44,43.749793552301526
BNT-I (D0-5),"ChAd (V2, D7)",0.234,121,261,135,382,256,"ADAM8, ADM, AKT1, APBB1IP, APOBEC3F, ARHGEF5, BCL3, BCL6, C1R, C5AR1, CALR, CCL3, CCL3L1, CCL4, CCNB2, CDK6, CNIH1, CSF1, CX3CR1, CXCL1, CXCL6, CXCR4, DCAF15, DNASE1, EIF2B2, EPX, F2, F2R, FCER1A, FGR, FOSL1, FPR2, FPR3, GATA3, GBP1, GTPBP1, HLA-C, HLA-DPA1, HLA-E, HLA-F, HMGB1, IDO1, IFI27, IFI30, IFI35, IFI6, IFIT1, IFIT2, IFITM3, IL10, IL12RB1, IL6ST, IL7R, IMPDH2, IRF9, ITGA6, ITGAL, ITK, JAK1, KLRF2, LAG3, LAIR1, LILRB1, LILRB2, LSM14A, MASP2, METTL3, MST1R, MTOR, MX1, MX2, MYO1C, MYO1G, MYSM1, NCAPH2, NCF1, NFKBIA, NLRP6, NOTCH1, PAFAH1B1, PDE4D, PML, PTGDS, PTGER4, PTMS, PTPN11, RAB10, RAP1GAP, RAPGEF3, RELA, RGS1, RPL22, RPS6, RPS6KA3, SERINC5, SLC15A3, SRC, STX4, STXBP4, SYVN1, TARM1, TBKBP1, TFEB, THEMIS, TICAM1, TNFRSF4, TNFSF15, TRIM26, TRIM59, TUBB4B, TXK, TYK2, UNG, VAV2, WAS, XCL1, YY1, ZBTB7A, ZC3HAV1, ZFP36L1, ZFPM1",31.68,47.27,1.1557818823103443e-52,51.93712411768614
BNT-I (D0-5),"I (D51, hospital)",0.225,115,267,130,382,245,"ADAM8, ADM, ALOX5, ANKHD1, ANXA3, APOBEC3A, AZU1, BATF2, BAX, BCL3, BCL6, BPI, BSG, BST1, C1R, CACNB3, CACNB4, CAMP, CCL7, CCNB2, CCR7, CD177, CD300LB, CD3G, CD46, CDC42, CEACAM8, CHGA, CLU, CTSG, CX3CR1, CXCR4, DCAF15, DEFA4, EIF2AK2, EIF2B2, ELANE, EP300, EPB42, ETS1, FPR1, FPR3, FUT7, GBP1, GBP2, GBP6, GCH1, GTPBP1, HAMP, HLA-C, HLA-E, HLA-F, IFI30, IFITM2, IFNE, IL10, IL1RN, IL7R, IMPDH2, ITGA6, ITGAM, ITK, JAG1, KHDRBS1, KIF5B, LCN2, LIMK1, LMBR1L, MAP2K6, MEN1, MLH1, MTOR, NCF1, NFKBIA, NLRC5, OLR1, PARP9, PDE12, PIK3AP1, PLEKHM2, PMS2, PRKCE, PSMB10, RAP1GAP, RAPGEF3, RELA, RELB, RNF19B, RNF213, ROMO1, RPL22, RPS19, RPS6, SDHAF4, SIRT2, SLC15A3, SNCA, SOS2, SRF, SSC5D, STAT1, STXBP4, TAP1, TARM1, TBKBP1, TICAM1, TOP2B, TRIM22, TRIM58, TRIM64B, TUBB4B, UBE2N, XRCC6, ZC3HAV1, ZNF3",30.1,46.94,4.654912624840578e-53,52.33208846654209
BNT-I (D0-5),"ZF2001 (V3, D14)",0.157,75,307,96,382,171,"ACTG1, ADM, ANKHD1, APBB1IP, APOBEC3F, BAX, BSG, BST2, CCL3, CD300C, CDKN2B, CHGA, CHRNB2, CNIH1, CORO1A, CSF1, CSF2RB, CSK, CX3CR1, EFNB1, FOSL2, FUT7, GBP6, GCH1, GSDMD, HAMP, IDE, IL10RB, IL12RB1, IL17RC, IL1RN, IMPDH2, KHDRBS1, LIF, LIMK1, LYL1, MAPK1, MAPK3, METTL3, MLH1, MSH2, NAGLU, NFKBIA, NKAP, PDE4D, PECAM1, PELI3, PIK3R1, PPP3CB, PRKCD, PSMA1, PSMB10, PTPN11, RAB10, RAB3B, RASGRP1, RNF19B, RPL13A, RPS6KA3, SHMT2, SLC15A3, SMPD1, SOD1, SOS1, SRF, SSC5D, STAT1, TFEB, TICAM1, TOP2B, TRIM23, UBE2N, UNG, XBP1, YY1",19.63,43.86,8.403175932914685e-54,53.07555654376438
BNT-I (D0-5),"ChAd (V1, D3)",0.366,198,184,159,382,357,"ADAR, AIF1, APBB1IP, APOBEC3F, ASXL1, AXL, BAG6, BATF2, BAX, BRAF, BST1, BST2, BTK, CACNB4, CALR, CASP4, CCL3, CCL3L1, CCNB2, CD1C, CD276, CD28, CD300C, CD68, CD86, CDC42, CFB, CFD, CFP, CIITA, CORO1A, CR2, CSF1, CSK, CTSS, CX3CR1, CXADR, CXCL1, CXCL12, CXCL3, CXCL6, DAPK1, DDX60, DEFB1, DNASE1, DOCK8, EDNRB, EFNB1, EIF2AK2, EIF2B2, ENPP1, EP300, EPHB2, EPX, FCER1A, FGR, FOSL1, FPR1, FPR2, FPR3, GAPT, GATA3, GBP1, GBP2, GBP6, GCH1, GRN, HAMP, HCK, HK1, HLA-C, HLA-DPA1, HLA-E, HMGB1, HSPD1, HYAL2, IDE, IDO1, IFI27, IFI30, IFI35, IFI6, IFITM3, IL10, IL10RB, IL12RB1, IL17RC, IL7, IMPDH2, IRAK1BP1, IRF2, IRF9, ITGAL, ITK, JAG1, JAGN1, KDELR1, KHDRBS1, KIT, KMT2E, LACC1, LAG3, LAIR1, LGALS1, LGALS9, LILRA2, LILRA6, LILRB1, LILRB2, LILRB4, LIMK1, LMBR1L, LTBR, LYL1, MAPK3, MASP2, MERTK, METTL3, MLH1, MNDA, MPL, MSN, MTOR, MX1, MX2, MYO1G, MYSM1, NAGLU, NCAPH2, NCF1, NCF2, NCR3LG1, NLRP6, NRROS, OAS2, PACS1, PARP9, PDIA3, PECAM1, PIK3AP1, PIK3CA, PIK3R1, PLD3, PML, PNMA1, POU2F2, PPP3CB, PRDX1, PRKCD, PSMA1, PSMB10, PSMB9, PTPN6, RAB10, RAP1GAP, RASGRP1, RNASE2, RNF213, RPL13A, RPL22, RPL30, RPL39, RPS6, SIRPA, SIRT2, SLC12A2, SLC15A3, SMPD1, SNCA, SOS2, SP100, SPI1, SRC, STAT1, STAT2, STXBP4, TAP1, TAP2, TARM1, TFEB, TNFRSF1B, TNFSF10, TNFSF15, TOP2B, TOR2A, TPD52, TRIM21, TRIM22, TRIM23, TRIM26, UNG, VAV1, WAS, XRCC5, XRCC6, YY1, ZBTB7A, ZNF3",51.83,55.46,3.619927018041606e-36,35.441300185262776
BNT-I (D0-5),"BNT-I (D51, hospital)",0.143,64,318,67,382,131,"AIMP1, APBB1IP, BST1, BTN2A1, CASP4, CCL2, CCL3, CCNB2, CD28, CD300LB, CDK6, CDKN2B, CSF2RB, CX3CR1, CXCL1, CYBA, F2, FGR, FPR2, HAMP, HCK, HMGB1, HRH2, IL10, IL17RC, IL6ST, IL7, IRF2, ITGA1, ITGA3, LILRB2, MASP2, MNDA, MPL, MST1R, NCF2, NLRX1, PAFAH1B1, PDE12, PRKCD, PTPN6, RAB10, RAB3B, RAB6A, RNASE2, RPS19, SDHAF4, SERINC5, SMPD1, SOS1, SP2, TARM1, TBKBP1, TNFRSF1B, TNFSF15, TOP2B, TRIM21, TRIM40, TRIM59, TRIM64B, VAV1, XRCC5, ZFP36L1, ZFP36L2",16.75,48.85,2.3812117235269294e-43,42.623201987933435
BNT-I (D0-5),"BNT-MO (V3, D1)",0.04,16,366,18,382,34,"APOBEC3A, BPI, CAMP, CD276, CEACAM8, CHRNB2, EDNRB, GAPT, IL11, IL7, LCN2, OLR1, ROMO1, RPL39, TARM1, VAV2",4.19,47.06,3.027329791337493e-22,21.518940265281827
BNT-I (D0-5),I (D0-4),0.431,207,175,98,382,305,"ADAR, ADM, ANXA3, APOBEC3A, APOBEC3F, ASXL1, AXL, BATF2, BAX, BPI, BST1, BST2, BTK, CACNB3, CACNB4, CALR, CAMP, CASP4, CCL2, CCL7, CCNB2, CCR7, CD177, CD1B, CD1C, CD28, CD300C, CD46, CD68, CD86, CDKN2B, CEACAM8, CFB, CHRNB2, CR2, CSK, CTLA4, CX3CR1, CXCL1, CXCL6, CXCR4, CYBA, DCAF15, DDX60, DEFB1, DHX9, EDNRB, EFNB1, EIF2AK2, EIF2B2, ENPP1, EPHB2, EPX, ETS1, F2, FCGR2C, FGR, FPR3, FUT7, GAPT, GBP1, GCH1, GPR183, GRN, GSDMD, GTPBP1, HK1, HLA-F, HMGB1, HYAL2, IDO1, IFI27, IFI30, IFI35, IFI6, IFIT1, IFIT2, IFITM2, IFITM3, IL10, IL10RB, IL11, IL12RB1, IL17RC, IL1RN, IL2RB, IMPDH2, IRAK1BP1, IRF2, IRF9, ITGA6, ITGAL, ITGAM, JAK1, KDELR1, KIT, LACC1, LAG3, LAIR1, LCN2, LGALS1, LGALS9, LIF, LILRA6, LILRB1, LILRB2, LILRB4, LIMK1, LMBR1L, LRP1, LSM14A, LTBR, LYL1, MAP2K2, MAP2K6, MAPK1, MASP2, MDK, MERTK, METTL3, MNDA, MST1R, MX1, MX2, MYO1C, MYO1G, NAGLU, NCAPH2, NCF1, NCR3LG1, NF1, NKAP, OAS2, OLR1, PAFAH1B1, PARP9, PDE4D, PDIA3, PECAM1, PIK3AP1, PIK3CA, PIK3R1, PLD3, PLEKHM2, PML, POU2F2, PPIB, PRKCD, PRKCE, PSMB10, PSMB9, PTGDS, PTPN6, RAB10, RAB3B, RAB6A, RAPGEF3, RELB, RGS1, RNASE2, RNF213, ROMO1, RORA, RPL13A, RPL22, RPL30, RPL39, RPS6, S100A7, SERINC5, SLC12A2, SMPD1, SOS1, SP100, SP2, SPI1, SRC, STAT1, STAT2, STXBP4, TAP1, TAP2, TARM1, TBKBP1, TFE3, TFEB, THEMIS, TICAM1, TNFRSF1B, TNFSF10, TNFSF15, TOP2B, TPD52, TRIM21, TRIM22, TRIM23, TRIM26, TUBB4B, UBA7, VAV2, XCL1, XRCC6, YY1, ZBTB7A, ZC3HAV1, ZFP36L2, ZNF3",54.19,67.87,5.625928596335038e-23,22.249805784153484
BNT-I (D0-5),I-I (D0-5),0.247,104,278,39,382,143,"ADAR, APOBEC3A, APOBEC3F, ASXL1, AXL, BATF2, BST2, BTK, CCL2, CCNB2, CCR7, CD28, CD300C, CD68, CD86, CFB, CHRNB2, CR2, CTLA4, CX3CR1, CXCR4, DDX60, DEFB1, DHX9, EFNB1, EIF2AK2, ENPP1, EPHB2, EPX, F2, FPR3, GBP1, GBP6, GCH1, GPR183, GRN, HMGB1, IFI27, IFI30, IFI35, IFI6, IFIT1, IFIT2, IFITM3, IL12RB1, IL1RN, IMPDH2, IRAK1BP1, IRF9, ITGA6, KDELR1, KIT, LACC1, LAG3, LGALS1, LGALS9, LIF, LILRA6, LILRB1, LILRB2, LILRB4, LIMK1, LMBR1L, MAP2K6, MASP2, MDK, MX1, MX2, MYO1G, NCAPH2, OAS2, PAFAH1B1, PARP9, PIK3AP1, PIK3R1, PML, POU2F2, RAB10, RNASE2, RNF213, RPL13A, RPL22, RPL30, RPS6, S100A7, SERINC5, SOS1, SP100, SRC, STAT1, STAT2, TAP1, TAP2, TBKBP1, TICAM1, TNFSF10, TNFSF15, TRIM21, TRIM22, TRIM23, UBA7, ZBTB7A, ZC3HAV1, ZNF3",27.23,72.73,1.0351045286801315e-20,19.985015791330962
BNT-I (D0-5),"BNT (V2, D1)",0.098,42,340,47,382,89,"APOBEC3F, BAG6, BATF2, BPI, BST1, CAMP, CCL4, CD1B, CD300LB, CD47, CD8B, CEACAM8, CHGA, CIITA, CTSG, CXCL1, CXCL12, CXCL3, CXCL6, ELANE, EPHB2, EPS8, FPR3, GBP1, GBP2, GBP6, IDO1, IFI27, IL12RB1, ITGA1, ITGAL, LAG3, LCN2, LILRB1, LYL1, NLRC5, OLR1, PML, RASGRP1, TAP1, TAP2, THEMIS",10.99,47.19,3.0247912965232265e-38,37.519304585274384
BNT-I (D0-5),"BNT (V3, D1)",0.013,5,377,8,382,13,"CD177, CHGA, GPR15, IFI27, IL11",1.31,38.46,1.0422313653296522e-13,12.98203586113988
BNT-I (D0-5),I-BNT (D5),0.11,49,333,62,382,111,"ALOX5, ANXA3, APBB1IP, C5AR1, CASP4, CCL2, CD300LB, CDKN2B, CSF2RB, CTSS, CXCL1, CXCL6, DHX9, DOCK8, EPB42, EPX, F2, FOSL2, FPR1, FPR2, GPR15, GPR183, GRN, HCK, IL2RB, ITGA1, ITGA3, LILRA2, LTBR, MDK, METTL3, MNDA, MYO1C, NCF2, NOTCH2, PAFAH1B1, PECAM1, PRKCD, PTGDS, PTPN6, RPS19, SPI1, STAT3, TFE3, TNFRSF1B, TRIM23, TRIM64B, XCL1, ZNF3",12.83,44.14,1.844645687784423e-45,44.73408703905347
BNT-I (D0-5),"BBIBP (V3, D07)",0.061,25,357,29,382,54,"ADM, BCL3, BCL6, CCL3, CD80, CDC42, CNIH1, CSF1, CXCR4, DOCK8, FOSL1, GATA3, GPR183, NFKBIA, PAFAH1B1, PSMA1, PTGER4, RELB, RGS1, RNF19B, RPL39, SIRT2, TICAM1, TRIM23, TUBB4B",6.54,46.3,6.464658897510356e-30,29.18945438537557
BNT-I (D0-5),"BBIBP (V3, D14)",0.086,38,344,61,382,99,"ADM, AIMP1, BAX, BCL3, BCL6, CACNB4, CCL3, CHRNB2, CNIH1, CSF1, DHX9, EPB42, EPS8, F2, FOSL2, GATA3, GPR183, IL1RN, KIF5B, NFKBIA, NKAP, PSMA1, PTGER4, RAB3B, RAP1GAP, RELA, RGS1, RNF19B, RPL13A, RPL39, RPS6, SNCA, SOD1, SSC5D, TICAM1, TRIM58, UBE2N, VEGFA",9.95,38.38,5.042470434035349e-49,48.29735663954513
BNT-I (D0-5),"BBIBP (V3, D28)",0.084,36,346,45,382,81,"ADM, AIMP1, BCL3, BCL6, BPI, CCL3, CHRNB2, CLU, CNIH1, CSF1, DHX9, EPB42, EPHB1, GATA3, IDE, IL1RN, KIF5B, LCN2, LSM14A, MPL, NFKBIA, PSMA1, PTGER4, RAP1GAP, RELA, RGS1, RNF19B, RPL39, RPS6, SIRT2, SNCA, SRF, TICAM1, TRIM23, TRIM58, ZFP36L1",9.42,44.44,7.366462848221593e-39,38.132740997113814
BNT-I (D0-5),"BNT (V1, D6)",0.03,12,370,23,382,35,"CCL4, CD1B, CHRNB2, CXCL12, CXCL3, FPR3, GPR15, IFI27, ITGAL, LAG3, MASP2, PMS2",3.14,34.29,4.35410149778182e-29,28.361101451405904
BNT-I (D0-5),"ChAd (V1, D6)",0.028,11,371,9,382,20,"AKT1, BCL2, CDK6, FANCC, FOSL2, ITGAM, LILRA2, MSN, TARM1, TFEB, XRCC5",2.88,55,3.1308135875515045e-13,12.504342790034908
BNT-I (D0-5),"ZF2001 (V3, D28)",0.083,36,346,52,382,88,"BCL2, BRAF, CCL3, CD27, CD3G, CDK6, CHRNB2, CNIH1, CSF1, CX3CR1, DCAF15, FOSL2, GTPBP1, GZMA, HAMP, IMPDH2, IRF9, LIF, LMBR1L, LRP1, MAP2K6, METTL3, NCAPH2, NFKBIA, PDE12, PPP3CB, PTGER4, RASGRP1, RPS6KA3, SOS1, STX4, TICAM1, TOP2B, UBA7, UBE2N, VEGFA",9.42,40.91,8.531813938769535e-44,43.06895862418449
BNT-I (D0-5),"ChAd-BNT (V3, D1)",0.01,4,378,0,382,4,"CCL3L1, CD177, CD300LB, MERTK",1.05,100,1,-0
BNT-I (D0-5),"ChAd (V2, D1)",0.005,2,380,7,382,9,"FOSL1, PDE4D",0.52,22.22,1.4212245890858864e-13,12.847337287242423
"BNT-I (D10, hospital)",BNT-I (D0-5),0.323,191,191,209,382,400,"ABL1, ACE, ADAR, ADM, ALOX5, ANKHD1, ANXA3, APBB1IP, APOBEC3A, ASXL1, AZU1, BATF2, BCL2, BCL3, BCL6, BMPR1A, BPI, BST1, BST2, BTK, BTN2A1, C1R, CACNB3, CAMP, CASP4, CCL4, CCNB2, CCR7, CD177, CD1B, CD1C, CD28, CD3G, CD46, CD8B, CDC42, CDK6, CDKN2B, CEACAM8, CFB, CIITA, CLU, CSF1, CTLA4, CTSG, CX3CR1, CXCR4, DDX60, DEFA4, DEFB1, DOCK8, EFNB1, EIF2AK2, ELANE, ENPP1, EPHB2, EPS8, EPX, ERCC1, ETS1, F2R, FCER1A, FGR, FPR1, FUT7, GAPT, GATA3, GBP1, GBP2, GBP6, GCH1, GPR15, GPR183, GZMA, HCK, HLA-C, HLA-DPA1, HLA-E, HLA-F, HRH2, IFI27, IFI30, IFI35, IFI6, IFIT1, IFIT2, IFITM2, IFITM3, IL10, IL10RB, IL1RN, IL2RB, IL7, IL7R, IMPDH2, IRAK1BP1, IRF9, ITGA1, ITGA3, ITGA6, ITGAM, ITK, JAG1, JAGN1, KIF5B, KLRF2, LAG3, LCN2, LGALS9, LILRA2, LILRA6, MAP2K6, MAPK3, MCOLN2, MEN1, METTL3, MNDA, MTOR, MX1, MX2, MYO1G, NCAPH2, NCF2, NCR3LG1, NFKBIA, NLRC5, NLRP6, OAS2, OLR1, PARP9, PDE12, PELI3, PIK3AP1, PIK3CA, PIK3R1, PML, PRKCD, PRKCE, PRKCQ, PSMB9, PTGDS, PTGER4, PTPN11, RAB10, RAB6A, RAP1GAP, RASGRP1, RELB, RNASE2, RNF19B, RNF213, ROMO1, RORA, RPL22, RPS6, RPS6KA3, S100A7, SLC12A2, SOS2, SP100, SSC5D, STAT1, STAT2, STAT3, STXBP4, TAP1, TARM1, TBKBP1, TCF3, TFE3, TFEB, TGFBR3, THEMIS, TNFRSF4, TNFSF10, TOP2B, TOR2A, TRIM21, TRIM22, TRIM64B, TXK, USP14, VAV1, VAV2, VCAM1, VEGFA, XCL1, ZBTB7A, ZC3HAV1, ZFPM1, ZNF3",50,47.75,5.352862540991779e-47,46.27141390895269
"BNT-I (D10, hospital)","BNT-I (D26, hospital)",0.461,207,193,49,400,256,"ABL1, ACE, ACKR3, ACTR3, ADAM17, ADARB1, ADD2, ADGRG3, ADM, ADORA1, ALOX5, ANKHD1, ANXA3, APBB1IP, APOBEC3A, ATF2, B2M, BCL10, BCL2, BCL3, BCL6, BMX, BPI, BST1, C1R, CACNB3, CAMLG, CAMP, CASP1, CASP6, CCL5, CCNB2, CCR7, CD160, CD177, CD1B, CD1C, CD1E, CD24, CD3G, CD40LG, CD46, CD55, CD58, CD6, CD81, CDC42, CDH26, CEACAM8, CEBPB, CFH, CH25H, CIITA, CLEC10A, CLNK, CLU, CNR2, CR1, CRISP3, CRTAM, CX3CR1, CXCR3, CXCR5, DEFA4, EFNB1, ENPP1, EOMES, EPS8, ETS1, F12, F2R, FAS, FASLG, FBXO38, FCAR, FCER1A, FCER1G, FCGR1A, FER, FKBP1A, FPR1, FUT4, GBP2, GBP6, GLI3, GNLY, GPR89B, GRB2, HDAC4, HLA-C, HLA-DPA1, HLA-E, HMGB2, HOXB4, HP, IFI27, IFITM1, IFITM2, IFITM3, IFNGR1, IFNGR2, IL10RB, IL18BP, IL18RAP, IL1R1, IL1R2, IL1RN, IL27, IL27RA, IL2RB, IL7, IL7R, IMPDH2, IPO7, IRAK1BP1, ITGA3, ITGAM, ITGB7, JAG1, JAK3, JMJD6, KMT2A, LAG3, LAX1, LCN2, LCP1, LFNG, LGALS3, LILRA5, LILRA6, LRRC8A, MAP2K6, MAP3K8, MEN1, MFSD6, MTOR, MYO1G, NCF2, NCR3LG1, NFKBIA, NLRC3, OLR1, OTUD7B, PARP1, PIK3CG, PLCG2, PPARG, PPP2CA, PRF1, PSMB8, PSME1, PTGDS, PTPRJ, PURA, PYHIN1, RAG1, RAP1GAP, RBPJ, RC3H1, RELB, RFPL4A, RHOA, RNASE4, RNF135, RNF19B, RORC, RPL22, RPS6KA3, S100A12, S100A7, S1PR1, SELL, SLC15A4, SMAD3, SNAP23, SOS2, SP3, SPIRE1, SPN, ST6GAL1, STAT3, STAT5B, STXBP4, SYK, TARM1, TBKBP1, TCF3, TFE3, TGFBR3, THEMIS, TNFAIP3, TNIP2, TOP2B, TOR2A, TOX, TREML1, TRIM64B, TRIM65, TRIM68, VAMP2, VAV2, VIM, ZAP70, ZC3H8, ZC3HAV1, ZFPM1, ZNF683",51.75,80.86,1.647131229286466e-13,12.783271798593091
"BNT-I (D10, hospital)","ChAd-BNT (V2, D3)",0.288,156,244,142,400,298,"ABL1, ADAM17, ADAR, ADGRG3, BATF2, BST1, BST2, BTK, BTNL8, CASP1, CASP4, CASP6, CCL4, CCL5, CCNB2, CCR7, CD247, CD28, CD34, CD38, CD55, CD58, CD81, CDK6, CEBPB, CFB, CIITA, CLEC6A, CLU, CNR2, CRTAM, CSF1, CTSW, CX3CR1, CXCR4, CXCR5, CYP11B1, DDX60, DEFB1, DOCK8, EFNB1, EGR1, EIF2AK2, EOMES, EPHB2, EPX, FASLG, FCER1G, FCGR1A, FGR, FUT4, GBP1, GBP2, GBP7, GCH1, GLI3, GPR183, GPR89A, GPR89B, HCK, HHEX, HLA-DOB, HLA-DPA1, IFI27, IFI35, IFI6, IFIT1, IFIT2, IFITM3, IFNGR1, IL1R1, IL1R2, IL1RN, IL27, IL27RA, IL34, IL7R, IMPDH2, IPO7, IRF9, ITGA4, ITK, JMJD6, KLRK1, KMT2A, LAX1, LCP1, LFNG, LGALS9, LRRC8A, MAPT, MCOLN2, METTL3, MFSD6, MNDA, MTOR, MX1, MX2, NCAPH2, NCF2, NLRC5, NLRP6, NRARP, OAS2, PARP9, PELI3, PIK3AP1, PIK3CA, PIK3R1, PKHD1L1, PML, PPP2CA, PPP3CA, PRKCQ, PSMB8, PTGER4, PTPN11, PTPN2, RAB10, RAB6A, RAP1GAP, RNASE2, RNF135, RNF213, RPL22, RPS6, RPS6KA3, S1PR1, SARM1, SELL, SELP, SLC12A2, SNAP23, SP100, SP3, ST3GAL1, ST6GAL1, STAT1, STAT2, SYK, TAP1, TNFAIP3, TNFRSF4, TNFSF10, TOX, TREML1, TRIM22, TRIM65, TXK, VAMP2, WFDC3, XCL1, ZBTB7A, ZC3H8, ZC3HAV1, ZNF3",39,52.35,1.8876791797336506e-46,45.724071814227905
"BNT-I (D10, hospital)","ChAd-BNT (V2, D7)",0.256,135,265,128,400,263,"ABL1, ADARB1, ADGRG3, ADM, ASXL1, ATF2, B2M, BATF2, BCL10, BCL3, BCL6, BTNL8, CASP1, CASP6, CAV1, CCL4, CCNB2, CCR7, CD38, CD55, CDC42, CDH26, CEBPB, CLEC10A, CLU, CRK, CRTAM, CSF1, CXCR4, CXCR5, EGR1, EPX, FCAR, FCER1G, FCGR1A, FCGR2A, FKBP1A, FPR1, GBP2, GPR89A, GPR89B, GRB2, HCK, HDAC4, HLA-DPA1, HLA-E, IFI30, IFI6, IFIT1, IFIT2, IFITM2, IFITM3, IFNAR1, IFNGR1, IFNGR2, IL10RB, IL15, IL1R2, IL1RN, IL27, IRF9, ITGA4, ITGB7, JAGN1, JMJD6, KLRK1, LFNG, LGALS3, LILRA2, LILRA5, MCOLN2, MEN1, METTL3, MTOR, NCF2, NFAM1, NFKBIA, NLRC3, NLRP6, NRARP, OTUD4, PARP1, PIK3CA, PIK3CG, PIK3R1, PKHD1L1, PLCG1, PPP2CA, PPP3CA, PSEN1, PSME1, PTGER4, PTPRJ, RAB6A, RAG1, RAP1GAP, RBPJ, RELB, RHOA, RNF135, RNF19B, RNF213, RPS6KA3, S100A12, S1PR1, SARM1, SELP, SFTPD, SKIL, SLC12A2, SLC15A4, SP3, SPIRE1, STAT1, STAT3, STXBP1, TESPA1, TFE3, TLR4, TMEM33, TNFAIP3, TNFRSF17, TREML1, TRIM21, TRPV1, TTLL1, TXK, VAV2, VIM, VNN1, WFDC3, ZBTB7A, ZC3H8, ZC3HAV1, ZNF3",33.75,51.33,1.625563818717879e-48,47.78899597567696
"BNT-I (D10, hospital)","I (D10, hospital)",0.595,278,122,67,400,345,"ABL1, ACE, ACTR3, ADAM17, ADAMTS13, ADARB1, ADD2, ADGRG3, ADM, ADORA1, ALOX5, ANKHD1, ANXA3, AP3B1, APBB1IP, APOBEC3A, ATF2, B2M, BATF2, BCL10, BCL2, BCL3, BCL6, BCR, BMX, BPI, BST1, BTN2A1, C1R, CACNB3, CAMLG, CAMP, CASP1, CASP6, CAV1, CCL5, CCNB2, CCND3, CCR7, CD160, CD177, CD1C, CD1E, CD24, CD247, CD28, CD34, CD38, CD3G, CD40LG, CD55, CD58, CD6, CD81, CD8B, CD96, CDC42, CDH26, CDK6, CDKN2B, CEACAM8, CEBPB, CFB, CFH, CH25H, CIITA, CLEC10A, CR1, CRISP3, CRK, CRKL, CRTAM, CRTC3, CTSW, CX3CR1, CXCR3, CXCR4, DBH, DDX60, DEFA4, DENND1B, DPP4, EFNB1, EIF2AK2, EOMES, EPHB2, ERCC1, ETS1, F12, FBXO38, FCAR, FCER1A, FCER1G, FCGR1A, FGR, FKBP1A, FLT1, FLT3, FPR1, GAPT, GATA3, GBP2, GBP6, GPR15, GPR183, GPR89A, GPR89B, GRB2, GZMM, HDAC4, HHEX, HLA-C, HLA-DPA1, HLA-E, HMGB2, HP, HRH2, IFI27, IFI6, IFIT1, IFITM1, IFITM2, IFNGR1, IFNGR2, IFNL1, IL10, IL10RB, IL18BP, IL18RAP, IL1R1, IL1R2, IL1RN, IL23R, IL27, IL27RA, IL2RB, IL32, IL34, IL4R, IL5RA, IL7R, IMPDH2, IPO7, IRAK1BP1, ITGA3, ITGA4, ITGA6, ITGAM, ITGB7, ITGB8, ITK, ITPKB, JAG1, JAK3, JMJD6, KIF5B, KMT2A, LCN2, LCP1, LFNG, LILRA5, LILRA6, LMO4, LRRC8A, LTB, MAP2K6, MAP3K8, MEN1, MFSD6, MS4A2, MX1, MYO1G, NCAPH2, NCF2, NFKBIA, NLRC3, NLRP6, OAS2, OTUD7B, PARP1, PARP9, PELI3, PIK3AP1, PIK3CA, PIK3CG, PIK3R1, PKNOX1, PLCG1, PLCG2, PPARG, PPP2CA, PPP3CA, PRKCD, PRKCE, PRKCQ, PSEN1, PSMB8, PTPN2, PURA, PYHIN1, RAB27A, RAB6A, RAG1, RAP1GAP, RASGRP1, RBPJ, RC3H1, RFPL4A, RHOA, RNASE2, RNASE3, RNASE4, RNF135, RORA, RORC, RPL22, RPS6, RPS6KA3, S100A12, S100A7, S1PR1, SARM1, SCG2, SELL, SFTPD, SKAP1, SKIL, SLC12A2, SLC15A4, SMAD3, SNAP23, SOS2, SP100, SP3, SPIRE1, SPN, ST6GAL1, STAT3, STAT5B, STXBP1, STXBP3, STXBP4, SUSD4, SYK, TARM1, TBKBP1, TCF3, TCF7, TESPA1, TFE3, TGFBR3, THBS1, THEMIS, TLR4, TMEM33, TNFAIP3, TNFRSF17, TNFRSF4, TOX, TRIM22, TRIM64B, TRIM65, TRIM68, TTLL1, VAMP2, VAV2, VEGFA, VIM, VNN1, XCL1, ZAP70, ZBTB46, ZBTB7A, ZC3H8, ZC3HAV1, ZFPM1, ZNF3, ZNF683",69.5,80.58,4.82253548569839e-10,9.316724568000035
