Cond1,Cond2,jaccard_distance,Shared,NotShared_cond1,NotShared_cond2,Total_Genes_Cond1,Total_Genes_Cond2,Genes_Names,Percentage_Shared_Cond1,Percentage_Shared_Cond2,pvalue,-log(p)
I (D0-4),"ChAd-BNT (V2, D7)",0.186,89,174,216,263,305,"ADARB1, ADM, APOBEC3F, APOBEC3H, ASXL1, ATF2, BATF2, CASP1, CCL7, CCNB2, CCR1, CCR7, CD38, CD68, CD86, CTSC, CXCL1, CXCL6, CXCR4, EGR1, EIF2B2, EPX, FCER1G, FCGR1A, GPR89B, GTPBP1, IFI30, IFI6, IFIT1, IFIT2, IFITM2, IFITM3, IGF1R, IL10RB, IL15, IL1RN, IL27, IRF9, ITGAL, ITGB7, KAT7, LGALS1, LILRA5, LILRB2, LTBR, LY86, MASP2, METTL3, NCKAP1L, NKAP, PDE4B, PDE4D, PDIA3, PECAM1, PI3, PIK3CA, PIK3R1, PPP3CA, PTAFR, RAB3B, RAB6A, RBX1, RELB, RNF135, RNF168, RNF213, RPL13A, S100A12, SLC12A2, SOS1, SPI1, SRC, SRP54, STAT1, STXBP1, TFE3, TICAM1, TNFRSF1B, TNFSF15, TRIM21, TRIM23, TRIM26, TXLNA, UBA7, VAV2, YY1, ZBTB7A, ZC3HAV1, ZNF3",33.84,29.18,1.647468554725964e-63,62.78318286604462
I (D0-4),"I (D10, hospital)",0.233,123,222,182,345,305,"ADARB1, ADM, ANXA3, AP3B1, APOBEC3A, ATF2, BATF2, BPI, BST1, CACNB3, CAMP, CASP1, CCL23, CCNB2, CCR7, CD177, CD1C, CD1E, CD28, CD34, CD38, CD58, CD81, CDKN2B, CEACAM8, CFB, CH25H, CRISP3, CTSK, CTSW, CX3CR1, CXCR4, DDX60, EDNRB, EFNB1, EIF2AK2, EPHB2, ETS1, F2, FCER1G, FCGR1A, FGR, FPR3, GAPT, GPR183, GPR89B, HHEX, HMGB1, HP, IDO1, IFI27, IFI6, IFIT1, IFITM1, IFITM2, IGF1R, IL10, IL10RB, IL17RC, IL1RN, IL27, IL2RB, IL34, IL5RA, IMPDH2, IRAK1BP1, ITGA6, ITGAM, ITGB7, LCN2, LILRA5, LILRA6, LILRB1, LMBR1L, LRP1, MAP2K6, MAPK1, MX1, MYO1C, MYO1G, NCAPH2, NF1, NOS2, OAS2, PARP9, PIK3AP1, PIK3CA, PIK3R1, PPARG, PPP3CA, PRKCD, PRKCE, RAB6A, RNASE2, RNASE3, RNF135, RORA, RPL22, RPS6, S100A12, S100A7, SELL, SLC12A2, SP100, SRC, SRP54, STXBP1, STXBP4, SUSD4, TARM1, TBKBP1, TFE3, THEMIS, TMEM229B, TRIM22, TRIM68, VAV2, XCL1, XRCC6, ZBTB7A, ZC3HAV1, ZFP36L2, ZNF3",35.65,40.33,1.1751828886317317e-58,57.92989454076011
I (D0-4),"I (D26, hospital)",0.187,94,199,211,293,305,"ADARB1, ANXA3, AP3B1, ATF2, AXL, BPI, BST1, CACNB3, CAMP, CCNB2, CCR1, CCR7, CD177, CD1E, CD28, CD38, CD46, CD58, CD81, CDKN2B, CEACAM8, CH25H, CLNK, CRISP3, CSK, CTSK, CTSW, CX3CR1, CXCR4, EDNRB, EFNB1, ETS1, FASLG, FCER1G, FCGR1A, GPR89B, GSDMD, GZMB, HMGB1, HP, HPRT1, IFI27, IGF1R, IL10, IL10RB, IL12RB1, IL17RC, IL2RB, IMPDH2, ITGA6, ITGAL, ITGAM, ITGB7, LAG3, LCN2, LILRA6, MAP2K6, MAPK1, MST1R, MYO1G, NAGLU, OLR1, PIK3R1, PPARG, PPP3CA, PRF1, PRKCE, PSMB10, PTGDS, RAB6A, RNASE2, RNASE3, RNF135, RORA, RPL22, S100A12, SELL, SMPD1, SP100, SRC, ST3GAL1, STXBP1, STXBP4, SUSD4, TARM1, THEMIS, TMEM229B, TRIM22, TRIM68, UBA7, XCL1, ZBTB7A, ZFP36L2, ZNF3",32.08,30.82,1.4952271344920816e-67,66.82529283023995
I (D0-4),"ZF2001 (V3, D07)",0.161,82,205,223,287,305,"ADM, APOBEC3A, BAX, BST1, C1S, CACNB3, CACNB4, CCR1, CD177, CD28, CD300C, CD68, CD81, CHRNB2, CLNK, CSK, CTSH, CXCL1, CXCR4, CYBA, DHX9, F2, FASLG, FCGR2B, GCH1, GPR183, GRN, HK1, HPRT1, IFI30, IL10RB, IL11, IL12RB1, IL1RN, IL34, IMPDH2, IRAK1BP1, LGALS1, LGALS9, LIF, LY86, LYL1, MAP2K2, MDK, METTL3, MST1R, NCF1, NKAP, PDE4B, PECAM1, PLD3, PLEKHM2, PPIB, PPP3CA, PSMB10, PTAFR, RAB3B, RAPGEF3, RELB, RGS1, RNF135, RPL13A, RPL30, RPL39, S100A12, SERINC5, SLC30A8, SLFN11, SMPD1, SP100, SPI1, ST3GAL1, STXBP1, STXBP4, TAP2, TFE3, TGFBR2, TICAM1, TNFRSF1B, TNFSF15, XRCC6, YY1",28.57,26.89,3.1774067192311795e-75,74.49792719039404
I (D0-4),"ChAd (V1, D7)",0.193,85,135,220,220,305,"ANXA3, AP3B1, APOBEC3F, APOBEC3H, BPI, BST2, BTN3A2, CASP1, CCNB2, CD177, CD1E, CD28, CD300C, CD38, CD68, CD86, CDH17, CDKN2B, CEACAM8, CLEC4G, CRISP3, CTLA4, CTSC, CXCL6, DHX9, EDNRB, EFNB1, EXOSC9, FASLG, FCGR2C, FGR, GCH1, GCNT1, GNL1, GTPBP1, HK1, HMGB1, IDO1, IFI27, IFI35, IFI6, IL12RB1, IL17RC, ITGAL, LAIR1, LCN2, LGALS9, LIF, LILRB1, LILRB2, LRP1, MAP2K6, MAVS, MERTK, MRC1, NKAP, PAFAH1B1, PDE4B, PECAM1, PI3, PIK3AP1, PIK3CA, PPIB, PPP3CA, PRKCE, RAB10, RNASE3, RNF213, SCIMP, SERINC5, SLC12A2, SOS1, SRP54, ST3GAL1, STAT1, STAT2, TICAM1, TMEM229B, TPD52, TRIM23, TRIM26, TUBB4B, UBA7, XRCC6, ZNF3",38.64,27.87,2.2510494320607085e-54,53.647614967977944
I (D0-4),"ChAd (V2, D3)",0.082,29,49,276,78,305,"CCNB2, CD1B, CHRNB2, CX3CR1, EFNB2, EIF2B2, EPX, F2, FASLG, GPR89B, GZMB, LAG3, MASP2, METTL3, NKAP, PPP3CA, PRF1, RAB6A, SERINC5, SERPINB9, SLC30A8, SLFN11, SOX4, STXBP4, TARM1, TMEM229B, VAV2, YY1, ZC3HAV1",37.18,9.51,5.246412018422673e-40,39.28013760579657
I (D0-4),"ChAd (V2, D7)",0.214,99,157,206,256,305,"ADM, AP3B1, APOBEC3F, BTN3A2, CALR, CCL1, CCNB2, CCR1, CLNK, CTSC, CTSK, CX3CR1, CXCL1, CXCL6, CXCR4, DCAF15, EFNB2, EIF2B2, EPX, F2, FASLG, FCGR1A, FGR, FPR3, GBP1, GPR89B, GTPBP1, GZMB, HLA-F, HMGB1, IDO1, IFI27, IFI30, IFI35, IFI6, IFIT1, IFIT2, IFITM3, IL10, IL12RB1, IL15, IL5RA, IMPDH2, IRF9, IRGM, ITGA6, ITGAL, JAK1, LAG3, LAIR1, LILRA5, LILRB1, LILRB2, LSM14A, MASP2, METTL3, MST1R, MX1, MX2, MYO1C, MYO1G, NCAPH2, NCF1, PAFAH1B1, PDE4B, PDE4D, PI3, PML, PPP3CA, PRF1, PTAFR, PTGDS, RAB10, RAPGEF3, RGS1, RPL22, RPS6, SCIMP, SERINC5, SERPINB9, SOX4, SRC, STXBP4, TARM1, TBKBP1, TEC, TFEB, THEMIS, TICAM1, TMEM229B, TNFSF15, TRIM26, TUBB4B, TXLNA, VAV2, XCL1, YY1, ZBTB7A, ZC3HAV1",38.67,32.46,5.297357915153438e-55,54.27594068303479
I (D0-4),"I (D51, hospital)",0.198,91,154,214,245,305,"ADM, ANXA3, AP3B1, APOBEC3A, BATF2, BAX, BPI, BST1, BTN3A2, CACNB3, CACNB4, CAMP, CCL7, CCNB2, CCR7, CD177, CD1E, CD46, CEACAM8, CEBPG, CH25H, CLNK, CRISP3, CX3CR1, CXCR4, DCAF15, EIF2AK2, EIF2B2, ETS1, FASLG, FCGR1A, FPR3, FUT7, GBP1, GCH1, GCNT1, GTPBP1, HLA-F, HP, IFI30, IFITM1, IFITM2, IGF1R, IL10, IL1RN, IL27, IMPDH2, ITGA6, ITGAM, KAT7, LCN2, LIMK1, LMBR1L, MAP2K6, MAVS, MT1G, NCF1, NCK1, NOS2, OLR1, PARP9, PDE4B, PIK3AP1, PLEKHM2, PPARG, PRF1, PRKCE, PSMB10, RAPGEF3, RELB, RNASE3, RNF213, ROMO1, RPL22, RPS6, S100A12, SFPQ, STAT1, STXBP4, TAP1, TARM1, TBKBP1, TICAM1, TOP2B, TRIM22, TRIM68, TUBB4B, TXLNA, XRCC6, ZC3HAV1, ZNF3",37.14,29.84,1.4492832660671074e-57,56.838846722281275
I (D0-4),"ZF2001 (V3, D14)",0.133,56,115,249,171,305,"ADM, APOBEC3F, BAX, BST2, BTN3A2, C1S, CD164, CD300C, CDKN2B, CEBPG, CHRNB2, CLNK, CSK, CX3CR1, EFNB1, FUT7, GCH1, GCNT1, GSDMD, HPRT1, IL10RB, IL12RB1, IL17RC, IL1RN, IMPDH2, LIF, LIMK1, LYL1, MAPK1, METTL3, MT1G, NAGLU, NKAP, PDE4D, PECAM1, PIK3R1, PPP3CA, PRKCD, PSMB10, PTAFR, RAB10, RAB3B, RPL13A, SCIMP, SLFN11, SMPD1, SOS1, STAT1, TFEB, TICAM1, TMEM229B, TOP2B, TRIM23, TRIM68, TXLNA, YY1",32.75,18.36,1.1563294436044997e-60,59.936918415780404
I (D0-4),"ChAd (V1, D3)",0.379,182,175,123,357,305,"ADAR, ADARB1, APOBEC3F, APOBEC3H, ASXL1, ATF2, AXL, BATF2, BAX, BST1, BST2, BTK, BTN3A2, CACNB4, CALR, CASP1, CASP4, CCNB2, CCR1, CD1C, CD1E, CD28, CD300C, CD34, CD38, CD58, CD68, CD86, CFB, CLEC4G, CLEC6A, CLNK, CNR2, CR2, CSK, CTSC, CTSH, CX3CR1, CXCL1, CXCL6, DDX60, DEFB1, EDNRB, EFNB1, EFNB2, EIF2AK2, EIF2B2, ENPP1, EPHB2, EPX, FCER1G, FCGR1A, FCGR2B, FGR, FPR3, GAPT, GBP1, GCH1, GCNT1, GPR89B, GRN, GZMB, HK1, HMGB1, HPRT1, HYAL2, IDO1, IFI27, IFI30, IFI35, IFI6, IFITM1, IFITM3, IGF1R, IL10, IL10RB, IL12RB1, IL15, IL17RC, IL27, IL2RG, IL5RA, IMPDH2, IRAK1BP1, IRF2, IRF9, IRGM, ITGAL, ITGB7, KDELR1, KIT, LACC1, LAG3, LAIR1, LGALS1, LGALS9, LILRA5, LILRA6, LILRB1, LILRB2, LILRB4, LIMK1, LMBR1L, LTBR, LY86, LYL1, MASP2, MAVS, MERTK, METTL3, MILR1, MNDA, MRC1, MT1G, MX1, MX2, MYO1G, NAGLU, NCAPH2, NCF1, NCKAP1L, NCR3LG1, OAS2, PARP9, PDIA3, PECAM1, PI3, PIK3AP1, PIK3CA, PIK3R1, PLD3, PML, POU2F2, PPARG, PRKCD, PSMB10, PSMB9, PTPN6, RAB10, RBX1, RNASE2, RNF135, RNF213, RPL13A, RPL22, RPL30, RPL39, RPS6, SCIMP, SELL, SERPINB9, SLC12A2, SMPD1, SOX4, SP100, SPI1, SRC, SRP54, ST3GAL1, STAT1, STAT2, STXBP4, TAP1, TAP2, TARM1, TEC, TFEB, TMEM229B, TNFRSF1B, TNFSF10, TNFSF15, TOP2B, TPD52, TRIM21, TRIM22, TRIM23, TRIM26, TXLNA, XRCC6, YY1, ZBTB7A, ZNF3",50.98,59.67,6.881651879177029e-30,29.162307300732294
I (D0-4),"BNT-I (D51, hospital)",0.132,51,80,254,131,305,"BST1, CASP4, CCL2, CCNB2, CCR1, CD28, CDKN2B, CEBPG, CH25H, CX3CR1, CXCL1, CYBA, EGR1, F2, FASLG, FGR, GCNT1, HMGB1, IL10, IL17RC, IRF2, LILRA5, LILRB2, MASP2, MAVS, MNDA, MST1R, PAFAH1B1, PRKCD, PTPN6, RAB10, RAB3B, RAB6A, RNASE2, SERINC5, SFPQ, SLFN11, SMPD1, SOS1, SP2, SRP54, TARM1, TBKBP1, TNFRSF1B, TNFSF15, TOP2B, TRIM21, TRIM68, TXLNA, WFDC13, ZFP36L2",38.93,16.72,5.48772458301916e-48,47.26060769305139
I (D0-4),"BNT-MO (V3, D1)",0.056,18,16,287,34,305,"APOBEC3A, BPI, CAMP, CEACAM8, CHRNB2, CRISP3, EDNRB, GAPT, HP, IL11, IL2RG, LCN2, OLR1, ROMO1, RPL39, STXBP1, TARM1, VAV2",52.94,5.9,5.306085099562917e-18,17.275225789036273
I (D0-4),I-I (D0-5),0.409,130,175,13,305,143,"ADAR, ADARB1, APOBEC3A, APOBEC3F, ASXL1, AXL, BATF2, BST2, BTK, BTN3A2, CASP1, CCL1, CCL2, CCNB2, CCR7, CD164, CD28, CD300C, CD38, CD68, CD86, CEBPG, CFB, CHRNB2, CNR2, CR2, CTLA4, CTSH, CX3CR1, CXCR4, DDX60, DEFB1, DHX9, EFNB1, EIF2AK2, ENPP1, EPHB2, EPX, F2, FPR3, GBP1, GCH1, GCNT1, GNL1, GPR183, GRN, GZMB, HMGB1, IFI27, IFI30, IFI35, IFI6, IFIT1, IFIT2, IFITM1, IFITM3, IGF1R, IL12RB1, IL15, IL1RL1, IL1RN, IMPDH2, IRAK1BP1, IRF9, IRGM, ITGA6, KDELR1, KIT, LACC1, LAG3, LGALS1, LGALS9, LIF, LILRA6, LILRB1, LILRB2, LILRB4, LIMK1, LMBR1L, LY86, MAP2K6, MASP2, MAVS, MDK, MX1, MX2, MYO1G, NCAPH2, NCK1, OAS2, PAFAH1B1, PARP9, PI3, PIK3AP1, PIK3R1, PML, POU2F2, RAB10, RNASE2, RNF135, RNF213, RPL13A, RPL22, RPL30, RPS6, S100A7, SCAP, SCIMP, SERINC5, SERPINB9, SOS1, SP100, SRC, ST3GAL1, STAT1, STAT2, TAP1, TAP2, TBKBP1, TICAM1, TMEM229B, TNFSF10, TNFSF15, TRIM21, TRIM22, TRIM23, UBA7, ZBTB7A, ZC3HAV1, ZNF3",42.62,90.91,2.2472772125666458e-5,4.648343351941245
I (D0-4),"BNT (V2, D1)",0.11,39,266,50,305,89,"APOBEC3F, APOBEC3H, BATF2, BPI, BST1, C1S, CAMP, CD1B, CEACAM8, CRISP3, CTSH, CXCL1, CXCL6, EGR1, EPHB2, FASLG, FCGR1A, FPR3, GBP1, GZMB, IDO1, IFI27, IL12RB1, ITGAL, KIR2DL3, LAG3, LCN2, LILRB1, LYL1, MRC1, OLR1, PML, SERPINB9, SRP54, TAP1, TAP2, THEMIS, TMEM229B, TXLNA",12.79,43.82,9.33835588491225e-37,36.02972957911924
I (D0-4),"BNT (V3, D1)",0.013,4,301,9,305,13,"CD177, IFI27, IL11, ST3GAL1",1.31,30.77,9.816335977494211e-15,14.008050585705389
I (D0-4),I-BNT (D5),0.098,37,268,74,305,111,"ANXA3, AP3B1, CASP4, CCL2, CCR1, CD38, CDKN2B, CXCL1, CXCL6, DHX9, EPX, F2, FCGR2B, GPR183, GRN, HP, IL2RB, LTBR, MDK, METTL3, MNDA, MYO1C, PAFAH1B1, PDE4B, PECAM1, PPP3CA, PRKCD, PTAFR, PTGDS, PTPN6, SPI1, SRP54, TFE3, TNFRSF1B, TRIM23, XCL1, ZNF3",12.13,33.33,4.030318028356544e-51,50.394660682764396
I (D0-4),"BBIBP (V3, D07)",0.044,15,290,39,305,54,"ADM, CCL8, CXCR4, GEM, GPR183, PAFAH1B1, PDE4B, RELB, RGS1, RPL39, SRP54, TEC, TICAM1, TRIM23, TUBB4B",4.92,27.78,1.96577637781577e-39,38.70646588803206
I (D0-4),"BBIBP (V3, D14)",0.058,22,283,77,305,99,"ADM, BAX, CACNB4, CD164, CD58, CHRNB2, DHX9, F2, GPR183, GZMB, HPRT1, IL1RL1, IL1RN, NCK1, NKAP, PDE4B, RAB3B, RGS1, RPL13A, RPL39, RPS6, TICAM1",7.21,22.22,4.723899982166249e-61,60.325699306158675
I (D0-4),"BBIBP (V3, D28)",0.04,15,290,66,305,81,"ADM, BPI, CHRNB2, DHX9, GEM, HPRT1, IL1RN, LCN2, LSM14A, PDE4B, RGS1, RPL39, RPS6, TICAM1, TRIM23",4.92,18.52,5.51268965064954e-59,58.2586364564241
I (D0-4),"BNT (V1, D6)",0.024,8,297,27,305,35,"CD1B, CHRNB2, FASLG, FPR3, IFI27, ITGAL, LAG3, MASP2",2.62,22.86,6.454474289313408e-33,32.190139124822494
I (D0-4),"ChAd (V1, D6)",0.019,6,299,14,305,20,"ITGAM, MRC1, S100A12, TARM1, TFEB, TGFBR1",1.97,30,3.993905257247512e-20,19.398602241604184
I (D0-4),"ZF2001 (V3, D28)",0.065,24,281,64,305,88,"ATF2, BTN3A2, C1S, CHRNB2, CX3CR1, DCAF15, GCNT1, GTPBP1, HPRT1, IL2RG, IMPDH2, IRF9, LIF, LMBR1L, LRP1, MAP2K6, METTL3, MT1G, NCAPH2, SOS1, ST3GAL1, TICAM1, TOP2B, UBA7",7.87,27.27,5.102977468477932e-52,51.29217634923338
I (D0-4),"ChAd-BNT (V3, D1)",0.007,2,303,2,305,4,"CD177, MERTK",0.66,50,1.2773839177364756e-4,3.8936785559111415
I (D0-4),"ChAd (V2, D1)",0.006,2,303,7,305,9,"FCGR2B, PDE4D",0.66,22.22,6.746637290490129e-13,12.170912637550787
I-I (D0-5),BNT-I (D0-5),0.247,104,278,39,382,143,"ADAR, APOBEC3A, APOBEC3F, ASXL1, AXL, BATF2, BST2, BTK, CCL2, CCNB2, CCR7, CD28, CD300C, CD68, CD86, CFB, CHRNB2, CR2, CTLA4, CX3CR1, CXCR4, DDX60, DEFB1, DHX9, EFNB1, EIF2AK2, ENPP1, EPHB2, EPX, F2, FPR3, GBP1, GBP6, GCH1, GPR183, GRN, HMGB1, IFI27, IFI30, IFI35, IFI6, IFIT1, IFIT2, IFITM3, IL12RB1, IL1RN, IMPDH2, IRAK1BP1, IRF9, ITGA6, KDELR1, KIT, LACC1, LAG3, LGALS1, LGALS9, LIF, LILRA6, LILRB1, LILRB2, LILRB4, LIMK1, LMBR1L, MAP2K6, MASP2, MDK, MX1, MX2, MYO1G, NCAPH2, OAS2, PAFAH1B1, PARP9, PIK3AP1, PIK3R1, PML, POU2F2, RAB10, RNASE2, RNF213, RPL13A, RPL22, RPL30, RPS6, S100A7, SERINC5, SOS1, SP100, SRC, STAT1, STAT2, TAP1, TAP2, TBKBP1, TICAM1, TNFSF10, TNFSF15, TRIM21, TRIM22, TRIM23, UBA7, ZBTB7A, ZC3HAV1, ZNF3",27.23,72.73,1.0351045286801315e-20,19.985015791330962
I-I (D0-5),"BNT-I (D10, hospital)",0.188,86,314,57,400,143,"ADAR, ADARB1, APOBEC3A, ASXL1, BATF2, BST2, BTK, CASP1, CCNB2, CCR7, CD160, CD164, CD28, CD38, CFB, CNR2, CTLA4, CTSH, CX3CR1, CXCR4, CXCR5, DDX60, DEFB1, EFNB1, EIF2AK2, ENPP1, EPHB2, EPX, F12, FLT1, GBP1, GBP6, GCH1, GPR183, HLA-DOB, IFI27, IFI30, IFI35, IFI6, IFIT1, IFIT2, IFITM1, IFITM3, IL15, IL1RN, IMPDH2, IRAK1BP1, IRF9, IRGM, ITGA6, LAG3, LGALS9, LILRA6, LMO4, MAP2K6, MX1, MX2, MYO1G, NCAPH2, NCK1, OAS2, PARP9, PIK3AP1, PIK3R1, PML, RAB10, RAG1, RNASE2, RNF135, RNF213, RPL22, RPS6, S100A7, SP100, ST3GAL1, STAT1, STAT2, TAP1, TBKBP1, THBS1, TNFSF10, TRIM21, TRIM22, ZBTB7A, ZC3HAV1, ZNF3",21.5,60.14,1.4784746497524347e-33,32.83018611758157
I-I (D0-5),"BNT-I (D26, hospital)",0.096,35,221,108,256,143,"ADARB1, APOBEC3A, CASP1, CCNB2, CCR7, CD160, CNR2, CR2, CX3CR1, CXCR5, EFNB1, ENPP1, F12, FPR3, GBP6, IFI27, IFITM1, IFITM3, IGF1R, IL1RN, IMPDH2, IRAK1BP1, LAG3, LILRA6, LMBR1L, MAP2K6, MYO1G, RAG1, RNF135, RPL22, S100A7, SERINC5, TBKBP1, UBA7, ZC3HAV1",13.67,24.48,4.652255824392474e-62,61.332336411727944
I-I (D0-5),"ChAd-BNT (V2, D3)",0.225,81,217,62,298,143,"ADAR, APOBEC3F, AXL, BATF2, BST2, BTK, CASP1, CCNB2, CCR7, CD28, CD300C, CD38, CD68, CD86, CFB, CNR2, CX3CR1, CXCR4, CXCR5, DDX60, DEFB1, EFNB1, EIF2AK2, EPHB2, EPX, FPR3, GBP1, GCH1, GCNT1, GPR183, GRN, HLA-DOB, IFI27, IFI35, IFI6, IFIT1, IFIT2, IFITM3, IGF1R, IL1RN, IMPDH2, IRF9, KIT, LACC1, LGALS9, LILRB1, LILRB2, LILRB4, MASP2, MX1, MX2, NCAPH2, OAS2, PARP9, PI3, PIK3AP1, PIK3R1, PML, POU2F2, RAB10, RNASE2, RNF135, RNF213, RPL13A, RPL22, RPL30, RPS6, SCIMP, SOS1, SP100, ST3GAL1, STAT1, STAT2, TAP1, TAP2, TNFSF10, TRIM22, TRIM23, ZBTB7A, ZC3HAV1, ZNF3",27.18,56.64,5.6953817048104374e-30,29.24447716416825
I-I (D0-5),"ChAd-BNT (V2, D7)",0.125,45,218,98,263,143,"ADARB1, APOBEC3F, ASXL1, BATF2, CASP1, CCNB2, CCR7, CD38, CD68, CD86, CXCR4, CXCR5, EPX, IFI30, IFI6, IFIT1, IFIT2, IFITM3, IGF1R, IL12B, IL15, IL1RN, IRF9, LGALS1, LILRB2, LY86, MASP2, NFKBID, PI3, PIK3R1, RAG1, RNF135, RNF213, RPL13A, SOS1, SRC, STAT1, TICAM1, TNFSF15, TRIM21, TRIM23, UBA7, ZBTB7A, ZC3HAV1, ZNF3",17.11,31.47,1.543563296627769e-53,52.811475556779534
I-I (D0-5),"I (D10, hospital)",0.138,59,286,84,345,143,"ADARB1, APOBEC3A, BATF2, CASP1, CCNB2, CCR7, CD160, CD28, CD38, CFB, CX3CR1, CXCR4, DDX60, EFNB1, EIF2AK2, EPHB2, F12, F2, FLT1, FPR3, GBP6, GPR183, HMGB1, IFI27, IFI6, IFIT1, IFITM1, IGF1R, IL1RN, IMPDH2, IRAK1BP1, ITGA6, LILRA6, LILRB1, LMBR1L, LMO4, MAP2K6, MX1, MYO1G, NCAPH2, OAS2, PARP9, PIK3AP1, PIK3R1, RAG1, RNASE2, RNF135, RPL22, RPS6, S100A7, SP100, SRC, TBKBP1, THBS1, TMEM229B, TRIM22, ZBTB7A, ZC3HAV1, ZNF3",17.1,41.26,1.2611805336754953e-50,49.89922274120875
I-I (D0-5),"I (D26, hospital)",0.095,38,255,105,293,143,"ADARB1, AXL, CCNB2, CCR7, CD160, CD28, CD38, CX3CR1, CXCR4, EFNB1, F12, FLT1, GZMB, HMGB1, IFI27, IGF1R, IL12B, IL12RB1, IMPDH2, ITGA6, LAG3, LILRA6, MAP2K6, MYO1G, PIK3R1, RAG1, RNASE2, RNF135, RPL22, SP100, SRC, ST3GAL1, THBS1, TMEM229B, TRIM22, UBA7, ZBTB7A, ZNF3",12.97,26.57,2.7582177729274997e-64,63.55937144742523
I-I (D0-5),"ZF2001 (V3, D07)",0.086,34,253,109,287,143,"APOBEC3A, CD28, CD300C, CD68, CHRNB2, CTSH, CXCR4, CXCR5, DHX9, F2, FLT1, GCH1, GPR183, GRN, IFI30, IL12RB1, IL1RN, IMPDH2, IRAK1BP1, LGALS1, LGALS9, LIF, LY86, MDK, RNF135, RPL13A, RPL30, SERINC5, SP100, ST3GAL1, TAP2, THBS1, TICAM1, TNFSF15",11.85,23.78,1.284772428590612e-67,66.89117379199024
I-I (D0-5),"ChAd (V1, D7)",0.145,46,174,97,220,143,"APOBEC3F, BST2, BTN3A2, CASP1, CCNB2, CD160, CD28, CD300C, CD38, CD68, CD86, CTLA4, CXCR5, DHX9, EFNB1, GCH1, GCNT1, GNL1, HMGB1, IFI27, IFI35, IFI6, IL12RB1, LGALS9, LIF, LILRB1, LILRB2, MAP2K6, MAVS, PAFAH1B1, PI3, PIK3AP1, RAB10, RAG1, RNF213, SCIMP, SERINC5, SOS1, ST3GAL1, STAT1, STAT2, TICAM1, TMEM229B, TRIM23, UBA7, ZNF3",20.91,32.17,2.4540547055258128e-46,45.61011576025483
I-I (D0-5),"ChAd (V2, D3)",0.062,13,65,130,78,143,"CCNB2, CHRNB2, CX3CR1, CXCR5, EPX, F2, GZMB, LAG3, MASP2, SERINC5, SERPINB9, TMEM229B, ZC3HAV1",16.67,9.09,2.9071455574139065e-41,40.536533223063046
I-I (D0-5),"ChAd (V2, D7)",0.157,54,202,89,256,143,"APOBEC3F, BTN3A2, CCL1, CCNB2, CX3CR1, CXCR4, CXCR5, EPX, F12, F2, FPR3, GBP1, GZMB, HMGB1, IFI27, IFI30, IFI35, IFI6, IFIT1, IFIT2, IFITM3, IL12RB1, IL15, IMPDH2, IRF9, IRGM, ITGA6, KLRC1, LAG3, LILRB1, LILRB2, MASP2, MX1, MX2, MYO1G, NCAPH2, NFKBID, PAFAH1B1, PI3, PML, RAB10, RPL22, RPS6, SCIMP, SERINC5, SERPINB9, SRC, TBKBP1, THBS1, TICAM1, TMEM229B, TNFSF15, ZBTB7A, ZC3HAV1",21.09,37.76,5.914725247269405e-45,44.22806542455527
I-I (D0-5),"I (D51, hospital)",0.118,41,204,102,245,143,"APOBEC3A, BATF2, BTN3A2, CCNB2, CCR7, CEBPG, CX3CR1, CXCR4, EIF2AK2, F12, FLT1, FPR3, GBP1, GBP6, GCH1, GCNT1, IFI30, IFITM1, IGF1R, IL1RN, IMPDH2, ITGA6, LIMK1, LMBR1L, MAP2K6, MAVS, NCK1, NFKBID, PARP9, PIK3AP1, RNF213, RPL22, RPS6, STAT1, TAP1, TBKBP1, THBS1, TICAM1, TRIM22, ZC3HAV1, ZNF3",16.73,28.67,1.365797633393907e-54,53.86461364414716
I-I (D0-5),"ZF2001 (V3, D14)",0.098,28,143,115,171,143,"APOBEC3F, BST2, BTN3A2, CD164, CD300C, CEBPG, CHRNB2, CX3CR1, EFNB1, GBP6, GCH1, GCNT1, IL12RB1, IL1RN, IMPDH2, LIF, LIMK1, LMO4, PIK3R1, RAB10, RPL13A, SCIMP, SOS1, STAT1, TICAM1, TMEM229B, TRIM23, WDFY4",16.37,19.58,3.6037745821689153e-53,52.44324238217185
I-I (D0-5),"ChAd (V1, D3)",0.263,104,253,39,357,143,"ADAR, ADARB1, APOBEC3F, ASXL1, AXL, BATF2, BST2, BTK, BTN3A2, CASP1, CCNB2, CD28, CD300C, CD38, CD68, CD86, CFB, CNR2, CR2, CTSH, CX3CR1, CXCR5, DDX60, DEFB1, EFNB1, EIF2AK2, ENPP1, EPHB2, EPX, FPR3, GBP1, GBP6, GCH1, GCNT1, GRN, GZMB, HLA-DOB, HMGB1, IFI27, IFI30, IFI35, IFI6, IFITM1, IFITM3, IGF1R, IL12B, IL12RB1, IL15, IMPDH2, IRAK1BP1, IRF9, IRGM, KDELR1, KIT, LACC1, LAG3, LGALS1, LGALS9, LILRA6, LILRB1, LILRB2, LILRB4, LIMK1, LMBR1L, LY86, MASP2, MAVS, MX1, MX2, MYO1G, NCAPH2, OAS2, PARP9, PI3, PIK3AP1, PIK3R1, PML, POU2F2, RAB10, RNASE2, RNF135, RNF213, RPL13A, RPL22, RPL30, RPS6, SCIMP, SERPINB9, SP100, SRC, ST3GAL1, STAT1, STAT2, TAP1, TAP2, TMEM229B, TNFSF10, TNFSF15, TRIM21, TRIM22, TRIM23, WDFY4, ZBTB7A, ZNF3",29.13,72.73,1.268815682286402e-19,18.896601462207776
I-I (D0-5),"BNT-I (D51, hospital)",0.079,20,111,123,131,143,"CCL2, CCNB2, CD28, CEBPG, CX3CR1, F2, GCNT1, HMGB1, LILRB2, MASP2, MAVS, PAFAH1B1, RAB10, RAG1, RNASE2, SERINC5, SOS1, TBKBP1, TNFSF15, TRIM21",15.27,13.99,1.0639310990850193e-51,50.9730864963418
I-I (D0-5),"BNT-MO (V3, D1)",0.023,4,30,139,34,143,"APOBEC3A, CHRNB2, FLT1, LMO4",11.76,2.8,1.2839679709453292e-29,28.891445809768097
I-I (D0-5),I (D0-4),0.409,130,175,13,305,143,"ADAR, ADARB1, APOBEC3A, APOBEC3F, ASXL1, AXL, BATF2, BST2, BTK, BTN3A2, CASP1, CCL1, CCL2, CCNB2, CCR7, CD164, CD28, CD300C, CD38, CD68, CD86, CEBPG, CFB, CHRNB2, CNR2, CR2, CTLA4, CTSH, CX3CR1, CXCR4, DDX60, DEFB1, DHX9, EFNB1, EIF2AK2, ENPP1, EPHB2, EPX, F2, FPR3, GBP1, GCH1, GCNT1, GNL1, GPR183, GRN, GZMB, HMGB1, IFI27, IFI30, IFI35, IFI6, IFIT1, IFIT2, IFITM1, IFITM3, IGF1R, IL12RB1, IL15, IL1RL1, IL1RN, IMPDH2, IRAK1BP1, IRF9, IRGM, ITGA6, KDELR1, KIT, LACC1, LAG3, LGALS1, LGALS9, LIF, LILRA6, LILRB1, LILRB2, LILRB4, LIMK1, LMBR1L, LY86, MAP2K6, MASP2, MAVS, MDK, MX1, MX2, MYO1G, NCAPH2, NCK1, OAS2, PAFAH1B1, PARP9, PI3, PIK3AP1, PIK3R1, PML, POU2F2, RAB10, RNASE2, RNF135, RNF213, RPL13A, RPL22, RPL30, RPS6, S100A7, SCAP, SCIMP, SERINC5, SERPINB9, SOS1, SP100, SRC, ST3GAL1, STAT1, STAT2, TAP1, TAP2, TBKBP1, TICAM1, TMEM229B, TNFSF10, TNFSF15, TRIM21, TRIM22, TRIM23, UBA7, ZBTB7A, ZC3HAV1, ZNF3",42.62,90.91,2.2472772125666458e-5,4.648343351941245
I-I (D0-5),"BNT (V2, D1)",0.084,18,125,71,143,89,"APOBEC3F, BATF2, CTSH, EPHB2, FPR3, GBP1, GBP6, GZMB, HLA-DOB, IFI27, IL12RB1, LAG3, LILRB1, PML, SERPINB9, TAP1, TAP2, TMEM229B",12.59,20.22,4.605867451063209e-40,39.336688564439555
I-I (D0-5),"BNT (V3, D1)",0.013,2,141,11,143,13,"IFI27, ST3GAL1",1.4,15.38,3.8839864498675574e-15,14.410722293892254
I-I (D0-5),I-BNT (D5),0.058,14,129,97,143,111,"CCL2, CD38, DHX9, EPX, F12, F2, GPR183, GRN, MDK, NFKBID, PAFAH1B1, TRIM23, WDFY4, ZNF3",9.79,12.61,1.9160950509254555e-52,51.71758295085845
I-I (D0-5),"BBIBP (V3, D07)",0.026,5,138,49,143,54,"CXCR4, GPR183, PAFAH1B1, TICAM1, TRIM23",3.5,9.26,2.088650762594346e-40,39.68013417110526
I-I (D0-5),"BBIBP (V3, D14)",0.061,14,129,85,143,99,"CD164, CHRNB2, DHX9, F2, FLT1, GPR183, GZMB, IL1RL1, IL1RN, NCK1, NFKBID, RPL13A, RPS6, TICAM1",9.79,14.14,2.8011054127758797e-48,47.55267054725445
I-I (D0-5),"BBIBP (V3, D28)",0.028,6,137,75,143,81,"CHRNB2, DHX9, IL1RN, RPS6, TICAM1, TRIM23",4.2,7.41,6.546828761344482e-52,51.18396901832281
I-I (D0-5),"BNT (V1, D6)",0.029,5,138,30,143,35,"CHRNB2, FPR3, IFI27, LAG3, MASP2",3.5,14.29,8.987775796617437e-29,28.046347769753837
I-I (D0-5),"ChAd (V1, D6)",0.006,1,142,19,143,20,KLRC1,0.7,5,7.6257220007891e-24,23.11771903117931
I-I (D0-5),"ZF2001 (V3, D28)",0.069,15,128,73,143,88,"BTN3A2, CHRNB2, CX3CR1, GCNT1, IMPDH2, IRF9, LIF, LMBR1L, MAP2K6, NCAPH2, SOS1, ST3GAL1, TICAM1, UBA7, WDFY4",10.49,17.05,5.455953082001656e-43,42.26312937301349
I-I (D0-5),"ChAd-BNT (V3, D1)",0,0,143,4,143,4,,0,0,5.355629891698439e-8,7.271189443151233
I-I (D0-5),"ChAd (V2, D1)",0,0,143,9,143,9,,0,0,1.0666024327713224e-14,13.971997430086898
"BNT (V2, D1)",BNT-I (D0-5),0.098,42,340,47,382,89,"APOBEC3F, BAG6, BATF2, BPI, BST1, CAMP, CCL4, CD1B, CD300LB, CD47, CD8B, CEACAM8, CHGA, CIITA, CTSG, CXCL1, CXCL12, CXCL3, CXCL6, ELANE, EPHB2, EPS8, FPR3, GBP1, GBP2, GBP6, IDO1, IFI27, IL12RB1, ITGA1, ITGAL, LAG3, LCN2, LILRB1, LYL1, NLRC5, OLR1, PML, RASGRP1, TAP1, TAP2, THEMIS",10.99,47.19,3.0247912965232265e-38,37.519304585274384
"BNT (V2, D1)","BNT-I (D10, hospital)",0.106,47,353,42,400,89,"ADD2, BATF2, BPI, BST1, CAMP, CCL4, CD1B, CD8B, CEACAM8, CIITA, CLEC10A, CRISP3, CRTAM, CTSG, CTSH, EGR1, ELANE, EPHB2, EPS8, FAS, FASLG, FCGR1A, GBP1, GBP2, GBP6, GBP7, GNLY, HLA-DOB, IFI27, IFNGR1, IL18BP, ITGA1, KLRC2, KLRC3, LAG3, LCN2, NLRC5, OLR1, PML, PRTN3, PYHIN1, RASGRP1, TAP1, THEMIS, VIM, VNN1, ZNF683",11.75,52.81,3.7245594190995203e-34,33.42892509289433
"BNT (V2, D1)","BNT-I (D26, hospital)",0.102,32,224,57,256,89,"ADD2, BANK1, BPI, BST1, CAMP, CD1B, CD40, CEACAM8, CIITA, CLEC10A, CRISP3, CRTAM, EPS8, FAS, FASLG, FCGR1A, FPR3, GBP2, GBP6, GNLY, IFI27, IFNGR1, IL18BP, IRF1, IRF2BP2, LAG3, LCN2, OLR1, PYHIN1, THEMIS, VIM, ZNF683",12.5,35.96,8.179636960496297e-40,39.087265971335036
"BNT (V2, D1)","ChAd-BNT (V2, D3)",0.096,34,264,55,298,89,"APOBEC3F, BANK1, BATF2, BST1, CCL4, CIITA, CRTAM, CXCL1, CXCL12, CXCL6, CXCL8, EGR1, EPHB2, FASLG, FCGR1A, FPR3, GBP1, GBP2, GBP7, HLA-DOB, IDO1, IFI27, IFNGR1, IFNLR1, ITGAL, LILRB1, LYL1, NLRC5, PML, SRP54, STAT6, TAP1, TAP2, TXLNA",11.41,38.2,3.5394890714513493e-41,40.45105942426343
"BNT (V2, D1)","ChAd-BNT (V2, D7)",0.067,22,241,67,263,89,"APOBEC3F, APOBEC3H, BATF2, CCL4, CD300LB, CLEC10A, CRTAM, CXCL1, CXCL3, CXCL6, CXCL8, EGR1, FCGR1A, GBP2, IFNGR1, IRF1, ITGAL, SRP54, TTC4, TXLNA, VIM, VNN1",8.37,24.72,3.5823458523177835e-51,50.445832488140134
"BNT (V2, D1)","I (D10, hospital)",0.085,34,311,55,345,89,"ADD2, BATF2, BPI, BST1, CAMP, CD300LB, CD8B, CEACAM8, CHGA, CIITA, CLEC10A, CRISP3, CRTAM, EPHB2, EPHB3, FCGR1A, FPR3, GBP2, GBP6, IDO1, IFI27, IFNGR1, IL18BP, LCN2, LILRB1, PYHIN1, RASGRP1, SRP54, THEMIS, TMEM229B, TYRO3, VIM, VNN1, ZNF683",9.86,38.2,2.1145133248029737e-44,43.67478957376127
"BNT (V2, D1)","I (D26, hospital)",0.101,35,258,54,293,89,"ADD2, BPI, BST1, CAMP, CD8B, CEACAM8, CIITA, CLEC10A, CRISP3, CRTAM, CTSG, ELANE, EPS8, FASLG, FCGR1A, GNLY, GZMB, IFI27, IFNGR1, IL12RB1, IL18BP, ITGAL, KLRC2, KLRC3, LAG3, LCN2, OLR1, PRTN3, PYHIN1, RASGRP1, THEMIS, TMEM229B, VIM, VNN1, ZNF683",11.95,39.33,8.251558084927634e-40,39.083464038868605
"BNT (V2, D1)","ZF2001 (V3, D07)",0.062,22,265,67,287,89,"BST1, C1S, CCL4, CTSG, CTSH, CXCL1, CXCL3, CXCL8, EPHB3, FASLG, IDO2, IL12RB1, IRF1, IRF2BP2, LYL1, PRTN3, SPNS2, STMP1, TAP2, TTC4, TYRO3, VIM",7.67,24.72,1.9234006799127523e-53,52.71593023476891
"BNT (V2, D1)","ChAd (V1, D7)",0.104,29,191,60,220,89,"APOBEC3F, APOBEC3H, BANK1, BPI, CCL4, CEACAM8, CIITA, CLEC10A, CRISP3, CTSG, CXCL6, EPS8, FASLG, IDO1, IFI27, IFNGR1, IFNLR1, IL12RB1, IRF1, IRF2BP2, ITGAL, LCN2, LILRB1, MRC1, NLRC5, PRTN3, SRP54, TMEM229B, VIM",13.18,32.58,2.5423301945269652e-39,38.59476804451836
"BNT (V2, D1)","ChAd (V2, D3)",0.071,11,67,78,78,89,"CD1B, CD300LB, FASLG, GNLY, GZMB, KLRC2, KLRC3, LAG3, PYHIN1, SERPINB9, TMEM229B",14.1,12.36,1.253706299517106e-32,31.90180419192514
"BNT (V2, D1)","ChAd (V2, D7)",0.085,27,229,62,256,89,"APOBEC3F, CCL4, CD40, CXCL1, CXCL6, CXCL8, FASLG, FCGR1A, FPR3, GBP1, GBP7, GZMB, IDO1, IFI27, IL12RB1, IRF1, ITGAL, KLRC3, LAG3, LILRB1, PML, PYHIN1, SERPINB9, THEMIS, TMEM229B, TXLNA, ZNF683",10.55,30.34,6.273491560613993e-45,44.202490681903406
"BNT (V2, D1)","I (D51, hospital)",0.092,28,217,61,245,89,"BATF2, BPI, BST1, CAMP, CD300LB, CEACAM8, CHGA, CLEC10A, CRISP3, CTSG, ELANE, FAS, FASLG, FCGR1A, FPR3, GBP1, GBP2, GBP6, IRF1, IRF2BP2, KLRC3, LCN2, NLRC5, OLR1, PRTN3, TAP1, TXLNA, VIM",11.43,31.46,7.801925456073687e-43,42.107798203494944
"BNT (V2, D1)","ZF2001 (V3, D14)",0.066,16,155,73,171,89,"APOBEC3F, C1S, CHGA, CXCL8, FAS, GBP6, IDO2, IL12RB1, IRF2BP2, LYL1, RASGRP1, STMP1, TMEM229B, TXLNA, TYRO3, VIM",9.36,17.98,6.960726628563181e-47,46.15734542212742
