Cond1,Cond2,jaccard_distance,Shared,NotShared_cond1,NotShared_cond2,Total_Genes_Cond1,Total_Genes_Cond2,Genes_Names,Percentage_Shared_Cond1,Percentage_Shared_Cond2,pvalue,-log(p)
"I (D26, hospital)","I (D51, hospital)",0.376,331,346,204,677,535,"ABCA1, ABCA13, ABCA6, ACKR3, ACSL1, ACTR3, ADAM17, ADAM9, AIM2, ALOX5, ANKHD1, ANXA1, ANXA3, AP3B1, APEH, AQP9, ARG1, ARRB2, ASGR2, ASPH, ATP8B2, AZU1, B3GNT5, BARD1, BASP1, BCL10, BCL2A1, BCL3, BCL6, BMI1, BMX, BPI, BRI3, BST1, C1R, CA4, CACNB3, CAMP, CASP6, CBX4, CCDC150, CCNB2, CCR7, CD163, CD177, CD1E, CD2, CD24, CD244, CD3D, CD3E, CD3G, CD4, CD40LG, CD46, CD53, CD55, CD69, CDA, CDC42, CDK14, CEACAM6, CEACAM8, CEBPB, CFH, CH25H, CHAF1B, CHIT1, CHUK, CISH, CLEC10A, CLEC12A, CLEC12B, CLEC2D, CLEC4D, CLEC4E, CLNK, CR1, CREB5, CRISP3, CRISPLD2, CSF1R, CSRP2, CST7, CSTA, CTSG, CX3CR1, CXCL2, CXCR3, CXCR4, DEFA4, DENND2D, DENND3, DENND5B, DOCK4, DRAM1, DYSF, EDN1, EGF, ELANE, ENG, ENPP5, ENTPD1, EOMES, EREG, ESCO2, ETS1, F12, F5, FAM43A, FASLG, FCAR, FCGR1A, FCGR1B, FCRL5, FLT1, FLT3, FPR1, FUT4, FYN, FZD5, GALNT6, GCA, GH1, GIMAP2, GIMAP6, GIMAP7, GLP2R, GLT1D1, GPM6B, GPR84, GPR87, HDAC4, HLA-B, HLA-DOA, HMGB2, HP, ICAM2, IER3, IFNE, IFNGR2, IGF1R, IGFBP7, IL10, IL13RA1, IL17RB, IL18R1, IL18RAP, IL1R1, IL1R2, IL27RA, IL4R, IL7R, IMPDH2, INHBA, IQGAP3, IRAK3, ITGA6, ITGAM, ITK, ITPKB, JAK3, JMJD6, KCNJ2, KIF5B, KLF4, KLF5, KLHL14, KLRC3, LAPTM5, LAT, LBH, LCN2, LCP1, LHFPL2, LIN7A, LPCAT2, LPXN, LRRC4, LRRK2, LRRN3, LTA, LTF, LY75, LY9, LY96, MAP2K6, MAP3K8, MAPK14, MAPKAPK2, MARCKS, MBOAT2, MCTP1, MEF2A, MEN1, MMP8, MMP9, MPP1, MS4A3, MTOR, NAIP, NCR1, NFKBIA, NLGN4Y, NLRC3, NOG, NRBP1, OLFM4, OLR1, ORM1, P2RY2, PAG1, PARP1, PAWR, PFKFB4, PGD, PIK3R3, PKMYT1, PLEK, PLEKHF1, PLSCR1, PPARG, PPBP, PPP2CA, PRF1, PRKACB, PRKAR2B, PRKCE, PRL, PROS1, PRRG4, PRTN3, PSMB10, PTGDR, PTGS1, PTH2R, PTPN2, PTPRE, PTX3, PURA, PYGL, QPCT, RAB32, RALGPS2, RAP1GAP, RBP7, RBPJ, RC3H1, REPS2, RETN, RFPL4A, RNASE3, RNF144B, RNF24, ROPN1L, RORC, RPL22, S100A11, S100A12, S100A8, S100A9, S100P, S1PR1, SAMSN1, SCD, SELP, SERPINB10, SFXN3, SH2B1, SH2D2A, SIGLEC5, SKIL, SLC15A4, SLC18A2, SLC19A2, SLC1A3, SLC22A15, SLC22A4, SLC24A1, SLC26A8, SLC27A2, SLC37A3, SLC8A1, SLPI, SMARCD3, SMPDL3A, SORT1, SOS2, SPARC, SPN, SSC5D, ST6GAL1, STXBP2, STXBP4, TARM1, TARP, TAX1BP1, TBX21, TCF4, TCN1, TESPA1, TFF3, THBS1, TIGIT, TLR2, TMEM158, TMEM51, TMEM56, TNFAIP3, TNFSF11, TRAF3IP3, TRAT1, TREML1, TRIB1, TRIM22, TRIM25, TRIM64B, TRIM65, TRIM68, TRPV1, UPP1, USP27X, VASP, VIM, VSIG10, WDFY3, ZBTB46, ZC3H8, ZMYND11, ZNF3, ZNF608",48.89,61.87,2.9530889977861384e-53,52.52972346442503
"I (D26, hospital)",I-BNT (D5),0.126,108,569,180,677,288,"ABCA1, ACSL1, AGPAT9, ALOX5, ANXA3, AP3B1, APBB1IP, AQP9, ARHGDIB, ASGR2, B3GNT5, BMX, CCR1, CD38, CDA, CDK14, CDKN2B, CHST15, CISH, CLEC4D, CLEC5A, CLIC3, CRK, DGAT2, DLL1, DOK3, DTX3, DTYMK, DYSF, ELOVL4, F12, F5, FCAR, FCGR1B, FGFBP2, FPR1, GAB1, GLT1D1, HAL, HLA-DRB1, HP, IFNGR1, IFNGR2, IGFBP7, IL1R1, IL2RB, ITGA3, KLRF1, LIN7A, LRRC4, LRRK2, LYN, MANSC1, MBOAT2, MCTP1, MGAM, MPP1, MXD1, NCF2, NLRC4, ORM1, PADI4, PDGFRB, PIK3CG, PLCG2, PPP3CA, PROK2, PSEN1, PTGDS, PTGS1, PTPRE, PTPRJ, PYGL, RAB31, RBM47, RNF24, S100A11, SAMSN1, SARM1, SELP, SIRPB1, SLA, SLC11A1, SLC22A4, SLC26A8, SLC36A1, SLC8A1, SNAP23, SPARC, STAT3, STEAP4, STXBP2, SUCNR1, SVIL, SYK, TARP, TBXAS1, TLR10, TLR6, TMCC3, TRIM25, TRIM64B, VANGL1, VASP, VSIG10, WDFY3, XCL1, ZNF3",15.95,37.5,3.988643968848589e-109,108.39917472760722
"I (D26, hospital)",I-I (D0-5),0.107,96,581,221,677,317,"ABCA1, ABLIM1, ADARB1, AIM2, APBB1, ARHGEF10L, ASGR2, ATP8B4, AXL, BARD1, BRI3, C1orf162, CA4, CCNB2, CCR7, CD160, CD28, CD38, CHAF1B, CLEC12A, CLEC12B, CX3CR1, CXCR4, DOCK4, EFNB1, EREG, ESCO2, F12, FLT1, GZMB, HLA-DOA, HMGB1, ICAM2, IFI27, IGF1R, IGFBP7, IL12B, IL12RB1, IL18, IL4I1, IMPDH2, IQGAP3, ITGA6, JUP, KLF4, KLRD1, KLRF1, LAG3, LHFPL2, LILRA6, LY96, MAP2K6, MARCKS, MAZ, MEF2A, MMP19, MS4A4A, MYD88, MYO1G, NKG7, NLGN4Y, ORM1, P2RX5, P2RY6, PAWR, PDGFRB, PIK3R1, PKIA, PKMYT1, PLSCR1, PRRG4, PTGER2, PTGIR, PTH2R, RAG1, RBBP8, RNASE2, RNF135, RPL22, SLC1A3, SP100, SPOCK2, SRC, ST3GAL1, SUCNR1, TCN1, THBS1, TMEM229B, TMEM51, TRIM22, TTYH2, UBA7, VANGL1, XCL2, ZBTB7A, ZNF3",14.18,30.28,1.0044461027844257e-133,132.9980733619434
"I (D26, hospital)","ZF2001 (V3, D28)",0.089,69,608,96,677,165,"ABCA13, ABLIM1, ACSL1, ATF2, BARD1, CCL5, CD2, CD27, CD3D, CD3E, CD3G, CD96, CX3CR1, CXCL2, DENND3, DGAT2, DOK3, FAM43A, GLP2R, HPRT1, ICAM2, IGLL5, IL21R, IL32, IMPDH2, KLF12, KLF5, LBH, LRRC8A, LTF, MAP2K6, MARCKS, MS4A4A, MXD1, NFKBIA, NLRC3, OLFM4, ORM1, P2RY2, PKIA, PPP2CA, PRKACB, PTGER2, PTPN4, PTPRCAP, PTPRE, PTX3, PURA, RASGRP1, RBPJ, RC3H1, RGL4, RPS6KA3, SAMSN1, SLC11A1, ST3GAL1, ST6GAL1, STAT5B, TC2N, TFF3, TLR2, TNFAIP3, TNFRSF17, TRIM25, UBA7, UPP1, USP27X, VEGFA, ZMYND11",10.19,41.82,8.133302446988152e-78,77.08973307761799
"I (D26, hospital)","ZF2001 (V3, D07)",0.176,189,488,399,677,588,"ABCA6, ABHD12, ABL1, ACSL1, ADA, AQP9, ARL4C, ARRB2, ATP1B1, BARD1, BCL2A1, BCL3, BCL6, BCR, BMX, BRI3, BST1, C1R, CACNB3, CAMK4, CCDC150, CCND3, CCR1, CD177, CD276, CD28, CD4, CD53, CD69, CD81, CDA, CDC42, CDH26, CEACAM6, CEBPB, CEBPD, CHAF1B, CHIT1, CLEC2D, CLNK, CORO2A, CSK, CSRP2, CSTA, CTSG, CXCL16, CXCL2, CXCR4, CYP4F2, DYSF, EGF, ENG, ERCC1, EREG, ESCO2, EVI5, FASLG, FBXO38, FCRL5, FKBP1A, FLT1, FLT3LG, FPR1, FUT4, GIMAP7, GLP2R, GLT1D1, GPR84, GPR89A, GZMM, HPRT1, ICAM2, IFNGR2, IL10RA, IL10RB, IL12RB1, IL13RA1, IL17RB, IL23A, IMPDH2, INHBA, IQGAP3, ITGB8, ITPKB, JAK3, JMJD6, KCNJ15, KCNN3, KLF5, LAMC2, LAMP2, LAPTM5, LCP1, LRRC8A, LY9, LYN, MAP3K8, MAPKAPK2, MARCKS, MAZ, MFSD1, MPP1, MS4A2, MS4A4A, MST1R, MXD1, NCF2, NELL2, NFKBIA, NRBP1, NRROS, PAG1, PGD, PIK3R3, PKIA, PLBD1, PLCG2, PLEK, PPBP, PPP2CA, PPP3CA, PRDX2, PRKAR2B, PROS1, PRTN3, PSMB10, PTGER2, PTGS1, PTH2R, PTPRCAP, PTPRJ, PTX3, PYGL, QPCT, RAB31, RAB32, RAB43, RAMP1, RHOA, RNF130, RNF135, RNF24, RRAGD, S100A11, S100A12, S100A8, S100A9, SCNN1B, SCPEP1, SELP, SHMT2, SLC22A15, SLC24A1, SLC2A6, SLC6A16, SLCO4C1, SMAD3, SMARCD3, SMC4, SMPD1, SOCS2, SP100, SPARC, SPNS1, SPOCK2, SSC5D, ST3GAL1, STAT4, STAT5B, STXBP1, STXBP2, STXBP4, TBXAS1, TCF4, TCF7, THBS1, TIE1, TLR10, TMEM158, TNF, TNFAIP3, TRAF3IP3, TREML1, TRIB1, TTYH3, VASP, VIM, ZBTB46, ZC3H8",27.92,32.14,2.461664266586429e-148,147.60877117850112
"I (D26, hospital)","ZF2001 (V3, D14)",0.117,101,576,188,677,289,"ABHD12, ACTR3, ADA, ANKHD1, APBB1IP, APEH, ATP8B2, BARD1, CASP6, CD24, CD53, CDKN2B, CHAF1B, CISH, CLEC2D, CLEC4E, CLNK, CORO2A, CRK, CSK, CX3CR1, CXCL2, DENND2D, DENND3, DGAT2, DUSP1, EFNB1, FAM43A, FBXO38, FKBP1A, FUT4, GIMAP2, GIMAP6, GLP2R, GPM6B, GPR89A, GSDMD, HPRT1, ICAM2, IL10RB, IL12RB1, IL17RC, IMPDH2, ITPKB, KLF4, KLF5, LAMP2, LBH, LCP1, LIME1, LRRC8A, MAPK1, MARCKS, MAZ, MFSD1, MXD1, NAGLU, NFKBIA, NOG, ORM1, PIK3CG, PIK3R1, PKIA, PLEK, PPP2CA, PPP2R1A, PPP3CA, PRDX2, PRKACB, PSMB10, PTGDR, PTGER2, PTPRCAP, PTPRE, PTX3, PURA, PYGL, RAB32, RAB43, RASGRP1, RFC2, RORC, RPS6KA3, SAMSN1, SH2D1A, SHMT2, SIT1, SLC24A1, SMPD1, SSC5D, STAT4, STAT5B, TFF3, TMEM229B, TNFRSF17, TRIB1, TRIM68, USP27X, VASP, VIM, ZMYND11",14.92,34.95,5.339081896290935e-116,115.2725334174387
"I (D26, hospital)","BNT-I (D51, hospital)",0.113,96,581,173,677,269,"ADAMTS13, AGPAT9, APBB1IP, APEH, ATP1B1, BIN2, BMI1, BST1, CCDC150, CCDC22, CCNB2, CCR1, CD244, CD28, CD40LG, CD69, CDA, CDK14, CDKN2B, CFH, CH25H, CHST15, CISH, CRK, CX3CR1, CYP4F2, CYP4F3, DENND2D, ELOVL4, EOMES, FAM43A, FASLG, FCRL3, GIMAP2, GIMAP6, GIMAP7, GLP2R, HMGB1, ICAM2, IGFBP7, IL10, IL10RA, IL17RB, IL17RC, ITGA3, KCNJ15, LBH, LPXN, LRRN3, LY9, MANSC1, MST1R, NCF2, NCR1, NLRC4, NOG, NPL, OLFM4, PIK3R3, PKMYT1, PLEKHF1, PSEN1, RAB27A, RAB6A, RAG1, RBM47, RFC2, RFPL4A, RNASE2, RORC, S1PR1, SLC11A1, SLC19A2, SMPD1, SOCS2, SPARC, SPN, ST6GAL1, STEAP4, SUCNR1, SV2A, TARM1, TARP, TBX21, TGFA, TIGIT, TLR5, TLR6, TNF, TNFAIP3, TREML1, TRIM64B, TRIM68, VNN1, XRCC5, ZFP36L2",14.18,35.69,6.0514662596263736e-111,110.21813938380834
"I (D26, hospital)","BNT-MO (V3, D1)",0.042,30,647,32,677,62,"ADAMTS13, ARG1, BPI, BRI3, CAMP, CD276, CEACAM6, CEACAM8, CRISP3, DOK3, EDNRB, FLT1, HP, INHBA, IQGAP3, LCN2, LTF, MARCKS, MMP8, OLFM4, OLR1, PRTN3, RNASE4, S100A11, S100A8, SIGLEC5, SIRPB1, STXBP1, TARM1, TCN1",4.43,48.39,1.452049108324545e-38,37.83801869554108
"I (D26, hospital)","BNT (V3, D1)",0.009,6,671,10,677,16,"ADD2, CD177, GPR89A, IFI27, PRTN3, ST3GAL1",0.89,37.5,1.3252536232538241e-18,17.877700999735385
"I (D26, hospital)","BBIBP (V3, D07)",0.05,37,640,64,677,101,"ANXA1, BCL3, BCL6, CD69, CDC42, CXCR4, DUSP1, EREG, FBXO38, FUT4, GATA3, GIMAP7, GPR84, HDAC4, JMJD6, JUN, KLF4, KLF5, LAPTM5, LRRC8A, MAP3K8, MAPKAPK2, MARCKS, NFKBIA, PKIA, PLEK, PPP2CA, PTGER2, PTX3, RAB32, RFPL4A, SLC24A1, TNFAIP3, TRAF3IP3, TRIB1, TRIM25, VIM",5.47,36.63,2.421371530272871e-66,65.61593856819236
"I (D26, hospital)","BNT (V1, D6)",0.025,18,659,44,677,62,"C1orf21, CAV1, FASLG, GIMAP7, GPR89A, GZMH, IFI27, IQGAP3, ITGAL, LAG3, OLFM4, PTGIR, PURA, PYHIN1, SAMD13, TMEM158, TNFRSF17, ZNF683",2.66,29.03,3.3422994605743742e-56,55.47595464114263
"I (D26, hospital)","ChAd (V1, D6)",0.024,17,660,32,677,49,"CEBPD, CSTA, IFNGR1, ITGAM, NAIP, PGD, PVRIG, RAB27A, RBP7, RFC2, RNF130, S100A11, S100A12, S100A9, TARM1, VNN2, XRCC5",2.51,34.69,2.0930584596571553e-43,42.67921864153615
"I (D26, hospital)","ChAd (V2, D1)",0.013,9,668,14,677,23,"ARL4C, CFH, EREG, GZMH, NLGN4Y, ST3GAL6, TMEM158, ZMYND11, ZNF683",1.33,39.13,1.4375021411356964e-23,22.84239149976339
"I (D26, hospital)","ChAd-BNT (V3, D1)",0.004,3,674,3,677,6,"CD177, CLEC12A, CLEC12B",0.44,50,3.8333004947257546e-7,6.416427134806177
BNT-I (D0-5),"BBIBP (V3, D14)",0.074,67,115,719,182,786,"ADM, AIMP1, ANXA1, ARL4C, ASGR2, BAX, BCL3, BCL6, C1QA, CACNB4, CCL3, CD69, CHRNB2, CNIH1, CSF1, DHX9, EPB42, EPS8, ESCO2, F2, FOSL2, G0S2, GATA3, GIMAP2, GPR183, GPR84, ICAM1, ICOS, IFIH1, IL1RN, ITM2A, JUN, KIF5B, KLF4, MARCKS, MCM7, NAV1, NCF4, NFKBIA, NINJ1, NKAP, NRBP1, PSMA1, PTGER4, RAB3B, RAP1GAP, RELA, RGS1, RHOH, RNF19B, RPL13A, RPL39, RPS6, SFXN3, SGK1, SLCO2B1, SNCA, SOD1, SSC5D, SVIL, TICAM1, TM4SF20, TRIB1, TRIM58, TSPAN5, UBE2N, VEGFA",36.81,8.52,5.862422083704824e-98,97.23192291636077
BNT-I (D0-5),"BBIBP (V3, D28)",0.073,64,94,722,158,786,"ADM, AIMP1, ANXA1, ARL4C, ASGR2, ATF3, BCL3, BCL6, BPI, BRD2, CCL3, CD69, CHRNB2, CLU, CNIH1, CSF1, DAB2, DHX9, DUSP6, EPB42, EPHB1, FOSB, G0S2, GATA3, GPR84, HGS, ICAM1, IDE, IFIH1, IL1RN, JUN, JUNB, KIF5B, KLF12, KLF4, LCN2, LSM14A, MARCKS, MPL, NFKBIA, NINJ1, NRGN, PSMA1, PTGER4, PTGS1, RAP1GAP, RELA, RGS1, RHOH, RNF19B, RPL39, RPS6, SGK1, SIRT2, SNCA, SRF, SUCNR1, TICAM1, TMEM140, TRIB1, TRIM23, TRIM58, TSPAN5, ZFP36L1",40.51,8.14,4.17876631753093e-84,83.37895191453343
BNT-I (D0-5),"BNT (V2, D1)",0.096,85,98,701,183,786,"ANKH, ANPEP, APOBEC3F, ATP1B2, ATP8B4, BAG6, BATF2, BPI, BST1, C1orf21, CAMP, CBFA2T3, CCL4, CCRL2, CD163, CD1B, CD274, CD300LB, CD47, CD8A, CD8B, CEACAM1, CEACAM8, CHGA, CIITA, CTSB, CTSG, CXCL1, CXCL10, CXCL12, CXCL3, CXCL6, CYBRD1, DOK3, ELANE, EPHB2, EPS8, FPR3, GBP1, GBP2, GBP6, GPNMB, GPX1, GRINA, HEPACAM2, IDO1, IFI27, IL12RB1, IL18, ITGA1, ITGAL, JUN, KCNQ1, KLF5, LAG3, LAMP3, LCN2, LILRB1, LTF, LYL1, MANSC1, MARCO, MMP8, NFE2, NLRC5, NOD2, NPDC1, OLFM4, OLR1, PDCD1LG2, PDGFRB, PML, PPP1R16B, PRAM1, PTGFRN, RASGRP1, RGL4, SGK1, SP140, STAB1, TAP1, TAP2, TCN1, THEMIS, TIMP2",46.45,10.81,2.027859989174312e-79,78.69296203357345
BNT-I (D0-5),"BNT-I (D10, hospital)",0.333,420,474,366,894,786,"ABCA1, ABCA13, ABL1, ABLIM1, ACE, ACTN1, ADAM9, ADAR, ADCY9, ADM, AGTRAP, AIM2, ALOX5, ANKH, ANKHD1, ANXA1, ANXA3, APBB1IP, APEH, APLP2, APOBEC3A, ARL4C, ASGR2, ASXL1, ATF3, ATP1B2, ATP8B4, AZU1, BATF2, BCL11B, BCL2, BCL3, BCL6, BMPR1A, BPI, BRCA2, BRI3, BST1, BST2, BTK, BTN2A1, C10orf54, C1QB, C1QC, C1R, C1orf162, C1orf21, C2, CACNA2D3, CACNB3, CAMP, CAPG, CARD11, CARD9, CASP4, CCDC22, CCL4, CCNB2, CCR6, CCR7, CCR9, CD163, CD177, CD1B, CD1C, CD2, CD274, CD28, CD3D, CD3G, CD46, CD8A, CD8B, CDC42, CDK6, CDKN2B, CEACAM1, CEACAM6, CEACAM8, CEBPD, CFB, CHAF1B, CHIT1, CIITA, CLU, CMTM2, CORO2A, CREB5, CRIM1, CSE1L, CSF1, CSF1R, CST3, CST7, CTLA4, CTSG, CX3CR1, CXCL10, CXCR4, DDX58, DDX60, DEFA4, DEFB1, DENND3, DGKZ, DHCR24, DMXL2, DOCK4, DOCK8, DOK3, DYSF, EFNB1, EIF2AK2, ELANE, ELOVL4, ENG, ENPP1, EPHB2, EPS8, EPX, ERCC1, ESCO2, ETS1, EVI2B, F2R, F5, FAM46A, FCER1A, FGD4, FGR, FOLR3, FPR1, FUT7, FYB, FZD5, GAB2, GABBR1, GAPT, GATA3, GBP1, GBP2, GBP6, GCH1, GPNMB, GPR15, GPR171, GPR183, GPR19, GPR84, GRINA, GSN, GZMA, HCK, HERC5, HESX1, HK3, HLA-A, HLA-C, HLA-DOA, HLA-DPA1, HLA-DQA1, HLA-E, HLA-F, HLX, HRH2, HRH4, HSPA6, ICOS, IFI27, IFI30, IFI35, IFI6, IFIH1, IFIT1, IFIT2, IFIT3, IFITM2, IFITM3, IGLL5, IL10, IL10RA, IL10RB, IL15RA, IL18, IL1RN, IL2RB, IL7, IL7R, IMPDH2, INHBA, INPP5D, IQGAP3, IRAK1BP1, IRF7, IRF9, ISG15, ITGA1, ITGA3, ITGA6, ITGAM, ITK, ITM2A, ITPR3, JAG1, JAGN1, KCNH1, KCNJ15, KIF5B, KLF12, KLF4, KLF5, KLF8, KLRB1, KLRF2, LAG3, LAMP3, LAT, LBH, LCN2, LCP2, LGALS9, LHFPL2, LILRA2, LILRA6, LILRB3, LIME1, LPXN, LRG1, LRRC25, LRRN3, LTA, LTF, LYN, MANSC1, MAP2K6, MAPK3, MARCKS, MAZ, MCOLN2, MCTP1, MEF2A, MEN1, METTL3, MMP19, MMP8, MMP9, MNDA, MS4A4A, MTOR, MX1, MX2, MYD88, MYO1G, NAIP, NAV1, NCAPH2, NCF1C, NCF2, NCR3LG1, NDFIP2, NFE2, NFKBIA, NLGN4Y, NLRC5, NLRP6, NOD2, NR3C2, NRBP1, NRP2, NT5E, OAS1, OAS2, OAS3, OASL, OLFM4, OLR1, OSCAR, P2RX5, PARP9, PDCD1LG2, PDE12, PELI3, PFKFB4, PGD, PIK3AP1, PIK3CA, PIK3R1, PIK3R5, PKIA, PKMYT1, PLSCR1, PLXDC2, PLXND1, PML, PPAP2B, PPP1R16B, PRKACB, PRKCD, PRKCE, PRKCQ, PRRG4, PSMB9, PTGDS, PTGER4, PTGS1, PTGS2, PTH2R, PTPN11, PTPN4, PTPRCAP, PVRIG, RAB10, RAB31, RAB6A, RAP1GAP, RASGRP1, RASGRP4, RBBP8, RELB, RHOH, RNASE2, RNF19B, RNF213, RNF24, ROMO1, RORA, RPL22, RPS6, RPS6KA1, RPS6KA3, RSAD2, S100A11, S100A7, S100P, SBNO2, SDC1, SECTM1, SERPINA1, SERPINB10, SERPING1, SFXN3, SH2B1, SH2D1A, SIGLEC1, SIGLEC5, SLA, SLAMF1, SLC12A2, SLC19A2, SLC1A3, SLC26A7, SLC26A8, SLC27A3, SLC38A1, SLC4A7, SLCO2B1, SLCO4C1, SMARCD3, SORT1, SOS2, SP100, SPNS1, SSC5D, ST6GALNAC2, STAT1, STAT2, STAT3, STAT4, STXBP2, STXBP4, SUCNR1, SVIL, TAP1, TARM1, TAS2R10, TBC1D8, TBKBP1, TCF3, TCN1, TFE3, TFEB, TFEC, TGFBR3, THEM4, THEMIS, TIMP2, TLR5, TMEM133, TMEM140, TNFRSF4, TNFSF10, TNFSF13B, TOP2B, TOR2A, TRAT1, TRIB1, TRIM21, TRIM22, TRIM25, TRIM64B, TRPC1, TSC2, TSPAN5, TTYH2, TXK, TYMP, TYROBP, USP14, USP18, VASP, VAV1, VAV2, VCAM1, VEGFA, XCL1, ZBP1, ZBTB7A, ZC3HAV1, ZFPM1, ZNF3",46.98,53.44,1.6326447473514942e-94,93.78710830457706
BNT-I (D0-5),"BNT-I (D26, hospital)",0.195,222,355,564,577,786,"ABCA1, ABCA13, ABL1, ACE, ADAM9, ADCY9, ADM, AIF1, AIM2, ALOX5, ANKH, ANKHD1, ANXA1, ANXA3, APBB1IP, APEH, APLP2, APOBEC3A, ARHGEF5, ASGR2, BCL2, BCL3, BCL6, BPI, BRI3, BST1, C10orf54, C1R, CACNB3, CAMP, CARD11, CARD9, CCDC22, CCNB2, CCR6, CCR7, CD177, CD1B, CD1C, CD2, CD27, CD274, CD3G, CD46, CD8A, CDC42, CEACAM6, CEACAM8, CEBPD, CHI3L2, CHIT1, CIITA, CLU, CMTM2, CR2, CREB5, CST7, CX3CR1, DCAF15, DEFA4, DENND3, DNASE1, DOCK4, DOK3, DYSF, EDNRB, EFNB1, ELOVL4, ENG, ENPP1, EPS8, ETS1, F2R, F5, FCER1A, FCRL2, FGD4, FOSB, FPR1, FPR3, FYB, G0S2, GABBR1, GBP2, GBP6, GPR84, GRINA, GTPBP1, HLA-A, HLA-C, HLA-DOA, HLA-DPA1, HLA-DQA1, HLA-E, ICAM1, IFI27, IFITM2, IFITM3, IL10RA, IL10RB, IL1RN, IL2RB, IL7, IL7R, IMPDH2, IQGAP3, IRAK1BP1, ITGA3, ITGAM, ITM2A, ITPR3, JAG1, JUN, JUP, KCNH1, KCNJ15, KLF12, KLF4, KLF5, KLF8, LAG3, LAT, LBH, LCN2, LHFPL2, LILRA6, LMBR1L, LRRC25, LRRN3, LTF, LYN, MAP2K6, MAPK1, MARCKS, MCTP1, MEF2A, MEN1, MMP8, MTOR, MYO1C, MYO1G, NAIP, NAV1, NCF2, NCR3LG1, NFKBIA, NLGN4Y, NR3C2, NRBP1, NRP2, NT5E, OLR1, PDZK1IP1, PFKFB4, PGD, PIK3R5, PKMYT1, PLSCR1, PRKACB, PRRG4, PTGDS, PTH2R, PTPN4, PTPRCAP, PTPRE, PVRIG, RAB31, RAP1GAP, RELB, RNF19B, RNF24, RPL22, RPS6KA3, S100A11, S100A7, S100P, SERINC5, SERPINA1, SERPINB10, SH2B1, SH2D1A, SHMT2, SIGLEC5, SIRPB1, SIRT2, SLC15A3, SLC19A2, SLC1A3, SLC24A4, SLC26A8, SLC38A1, SMARCD3, SORT1, SOS2, SPNS1, SRF, STAT3, STXBP2, STXBP4, SVIL, TARM1, TBKBP1, TCF3, TCN1, TFE3, TGFBR3, THEMIS, TLR5, TMEM37, TMEM51, TOP2B, TOR2A, TRIB1, TRIM25, TRIM64B, TTYH2, TUBB4B, UBA7, VASP, VAV2, ZC3HAV1, ZFPM1",38.47,28.24,7.499832067644577e-141,140.12494846099654
BNT-I (D0-5),"ChAd (V1, D7)",0.199,209,266,577,475,786,"ABCA13, ACTN1, ADCY9, AGPAT3, AGTRAP, AIF1, AIMP1, ANKH, ANXA1, ANXA3, APEH, APOBEC3F, ATF3, BPI, BRCA2, BST2, C10orf10, C1QA, C1QB, C1R, C1orf162, C2, C3, CAMK2D, CASP3, CCL3, CCL3L1, CCL4, CCNB2, CCR6, CCR9, CD177, CD27, CD28, CD300C, CD3D, CD68, CD69, CD86, CDKN2B, CEACAM6, CEACAM8, CEBPD, CHAF1A, CHAF1B, CHIT1, CIITA, CMTM2, CSE1L, CSF1, CSF1R, CST3, CTLA4, CTSG, CXADR, CXCL10, CXCL11, CXCL6, CYBRD1, DDX58, DEFA4, DHX9, DNASE1, DNM2, DOCK4, DOCK8, DOK3, EDNRB, EFNB1, EPB42, EPS8, ERCC1, ESCO2, FAM46A, FCGR2C, FGR, FKBP14, FOSB, FPR1, FPR2, FYB, FZD5, GABBR1, GCH1, GIMAP2, GPBAR1, GPR19, GRAMD1C, GTPBP1, HK1, HK3, HMGB1, HSPA6, HSPD1, IDE, IDO1, IFI27, IFI35, IFI6, IGLL5, IL12RB1, IL17RC, IL31RA, IL6ST, IL7, IQGAP3, ITGAL, JUN, KCNJ15, KHDRBS1, KLF4, LAIR1, LAMP3, LCN2, LGALS9, LIF, LILRA1, LILRB1, LILRB2, LRP1, LRP11, LTF, MANSC1, MAP2K6, MARCKS, MCM7, MERTK, MMP19, MMP9, MS4A14, MS4A4A, MS4A6A, MSR1, MTOR, MYOF, NFKBIA, NKAP, NLRC5, NLRP6, NOTCH2, NRBP1, NUP37, OAS1, OAS3, OLFM4, PAFAH1B1, PECAM1, PELI3, PIK3AP1, PIK3CA, PKMYT1, PLXNB2, PPAP2B, PPIB, PRKCE, PSMA1, PTGER4, PTGS2, PTPN11, PTPRE, RAB10, RELA, RNF213, S100P, SDC1, SDHAF4, SERINC5, SERPINA1, SFN, SFXN3, SH2B1, SH2D1A, SHMT2, SIGLEC1, SIGLEC16, SIGLEC7, SIRT2, SLA, SLC12A2, SLC24A4, SLC27A3, SLC7A11, SMARCD3, SNCA, SOS1, SSC5D, STAT1, STAT2, SYVN1, TBC1D8, TICAM1, TLR7, TMEM133, TNFSF13, TNFSF14, TOR2A, TPD52, TRAT1, TRIM23, TRIM26, TTYH2, TUBB4B, TXNDC15, UBA7, USP14, XBP1, XRCC6, ZBP1, ZNF3",44,26.59,1.8851478155863365e-117,116.72465459082868
BNT-I (D0-5),"ChAd (V2, D3)",0.058,51,96,735,147,786,"ADCY9, BMPR1A, BRCA2, CCNB2, CCR6, CCRL2, CD1B, CD300LB, CDK6, CFD, CHRNB2, CLC, CSF1, CST7, CX3CR1, EIF2B2, EPX, F2, F2R, FKBP14, FOLR3, FOSB, FYB, GHSR, IL6ST, LAG3, LBH, LRP11, MASP2, METTL3, MYSM1, NKAP, PDGFRB, PTGS2, PTMS, RAB6A, RAC2, RNF24, SERINC5, SIRT2, SLA, SLCO4C1, STXBP4, SULF2, SYVN1, TARM1, THEM4, TNFRSF9, VAV2, YY1, ZC3HAV1",34.69,6.49,4.1000624814403583e-91,90.38720952495392
BNT-I (D0-5),"ChAd (V2, D7)",0.225,238,270,548,508,786,"ABLIM1, ADAM8, ADCY9, ADM, AKT1, ANKH, APBB1IP, APEH, APOBEC3F, ARHGEF5, ARL4C, ATF3, BCL3, BCL6, BRCA2, BRD2, C1QA, C1QB, C1QC, C1R, C5AR1, CALR, CARD9, CBFA2T3, CCL3, CCL3L1, CCL4, CCNB2, CCR6, CCR9, CCRL2, CD74, CDH5, CDK6, CEBPD, CLC, CMTM2, CNIH1, CSF1, CSF1R, CST3, CST7, CX3CR1, CXCL1, CXCL10, CXCL16, CXCL6, CXCR4, DAB2, DCAF15, DDX58, DENND3, DHCR24, DNASE1, DOK3, EHD3, EIF2B2, EPB41L3, EPX, F2, F2R, F5, FCER1A, FGR, FKBP14, FOLR3, FOSB, FOSL1, FPR2, FPR3, FYB, G0S2, GAS2L1, GATA3, GBP1, GHSR, GP5, GPBAR1, GPR84, GPX1, GTPBP1, GYPA, HERC5, HESX1, HLA-C, HLA-DPA1, HLA-E, HLA-F, HMGB1, HRH4, ICAM1, IDO1, IFI27, IFI30, IFI35, IFI6, IFIT1, IFIT2, IFIT3, IFITM3, IL10, IL12RB1, IL4I1, IL6ST, IL7R, IMPDH2, INPP5D, IRF7, IRF9, ISG15, ITGA6, ITGAL, ITK, JAK1, JUP, KCNH1, KCNJ15, KCNJ16, KLF4, KLRF2, LAG3, LAIR1, LILRB1, LILRB2, LRG1, LSM14A, MAL, MARCKS, MARCO, MASP2, METTL3, MMP19, MMP9, MPEG1, MS4A4A, MST1R, MTOR, MX1, MX2, MYO1C, MYO1G, MYO7B, MYSM1, NAV1, NCAPH2, NCF1, NFKBIA, NINJ1, NLRP6, NOTCH1, NR1H2, NR3C2, NRGN, NRP2, OAS3, OASL, PAFAH1B1, PDE4D, PDGFRB, PIK3R5, PKIA, PML, PPAP2B, PTGDS, PTGER4, PTGFRN, PTGS2, PTH2R, PTMS, PTPN11, PTPRE, RAB10, RAC2, RAD54B, RAP1GAP, RAPGEF3, RARA, RELA, RGS1, RHOU, RPL22, RPS6, RPS6KA3, RSAD2, SBNO2, SECTM1, SERINC5, SERPING1, SGK1, SIGLEC1, SLA, SLAMF1, SLC15A3, SLC16A3, SLC19A2, SLC27A3, SLC38A1, SLCO4C1, SORCS3, SRC, STAB1, STX4, STXBP4, SUCNR1, SYVN1, TARM1, TBKBP1, TFEB, THEM4, THEMIS, TICAM1, TMEM106C, TMEM140, TMEM64, TNFAIP2, TNFRSF4, TNFRSF9, TNFSF15, TRIB1, TRIM26, TRIM59, TRPC1, TUBB4B, TXK, TYK2, TYMP, TYROBP, UNG, USP18, VAV2, WAS, XCL1, YY1, ZBP1, ZBTB7A, ZC3HAV1, ZFP36L1, ZFPM1",46.85,30.28,7.360838241157141e-109,108.13307272604567
BNT-I (D0-5),"ChAd-BNT (V2, D3)",0.304,345,350,441,695,786,"ABCC3, ABL1, ACTN1, ACTR2, ADAM9, ADAP2, ADAR, AGPAT3, AIF1, AIM2, ANXA5, APEH, APLP2, APOBEC3F, ARHGEF10L, ARL4C, ATF3, ATP1B2, ATP8B4, AXL, BATF2, BRCA2, BST1, BST2, BTK, C10orf10, C1QA, C1QB, C1QC, C1orf162, C2, C3, CALM1, CASP3, CASP4, CCL3L1, CCL4, CCL7, CCNB2, CCR6, CCR7, CCRL2, CD163, CD274, CD276, CD28, CD300C, CD33, CD36, CD3D, CD68, CD69, CD86, CD8A, CDK6, CENPL, CFB, CFD, CHAF1A, CHAF1B, CIITA, CLEC12B, CLEC2D, CLPTM1, CLU, CMTM2, CREB5, CSF1, CSF1R, CST7, CTSB, CTSS, CX3CR1, CXCL1, CXCL10, CXCL11, CXCL12, CXCL16, CXCL6, CXCR4, CYBA, CYBB, CYFIP1, DAB2, DAPK1, DDX58, DDX60, DEFB1, DHX58, DMXL2, DOCK2, DOCK8, DYSF, EFNB1, EHD3, EIF2AK2, EIF2B2, ELOVL4, EMILIN2, EPB41L3, EPHB2, EPX, ESCO2, F5, FAM198B, FAM46A, FCGR2C, FCN1, FGD4, FGR, FKBP14, FOXO1, FPR3, FYB, FZD5, GBP1, GBP2, GCH1, GPBAR1, GPR171, GPR183, GRAMD1C, GRN, HAMP, HCK, HERC5, HESX1, HK1, HLA-DOA, HLA-DPA1, HLA-DQA1, HS3ST3B1, HSPD1, IDE, IDO1, IFI27, IFI35, IFI6, IFIH1, IFIT1, IFIT2, IFIT3, IFITM3, IL15RA, IL17RC, IL18, IL1RN, IL31RA, IL4I1, IL7R, IMPDH2, IQGAP3, IRF7, IRF9, ISG15, ITGA2B, ITGAL, ITK, ITM2A, JUNB, JUP, KIR3DL3, KIT, KLF4, KLRB1, LACC1, LAIR1, LAMP3, LBH, LCP2, LGALS9, LHFPL2, LILRA1, LILRB1, LILRB2, LILRB4, LIME1, LPXN, LRFN4, LRG1, LRP1, LTA, LTBR, LYL1, MARCH1, MARCKS, MARCO, MASP2, MAZ, MCOLN2, MCTP1, MEF2A, METTL3, MLH1, MMP19, MNDA, MPEG1, MPL, MS4A14, MS4A4A, MS4A6A, MSN, MSR1, MTOR, MX1, MX2, MYD88, MYO7B, MYOF, MYSM1, NAIP, NAV1, NCAPH2, NCF1, NCF1C, NCF2, NLRC5, NLRP6, NOD2, NOTCH2, NRGN, NRROS, OAS1, OAS2, OAS3, OASL, OSCAR, P2RX5, P2RY6, PARP9, PDCD1LG2, PDE4D, PDZK1IP1, PELI3, PF4, PFKFB4, PGD, PIK3AP1, PIK3CA, PIK3R1, PIK3R5, PILRA, PKMYT1, PLA2G7, PLSCR1, PLXDC2, PLXNB2, PML, PNMA1, POU2F2, PPAP2B, PPP1R16B, PPP3CB, PRAM1, PRDX1, PRKCQ, PRRG4, PTGER4, PTGFRN, PTGS1, PTPN11, RAB10, RAB6A, RAP1GAP, RARRES3, RBBP8, RGL1, RGS1, RHOH, RHOU, RIN2, RNASE2, RNF213, RPL13A, RPL22, RPL30, RPL39, RPS6, RPS6KA1, RPS6KA3, RSAD2, S100P, SAC3D1, SCARB2, SECTM1, SERPINA1, SERPING1, SFN, SFXN3, SH2D1A, SIGLEC1, SIGLEC16, SIRPA, SIRPB1, SLA, SLC12A2, SLC19A2, SLC1A3, SLC24A4, SLC27A3, SLCO2B1, SNCA, SORT1, SOS1, SP100, SP140, STAB1, STAT1, STAT2, STAT4, TAP1, TAP2, TAS2R10, TBC1D8, TFEC, TLR5, TLR7, TMEM140, TNFRSF4, TNFSF10, TNFSF13B, TNFSF14, TNS3, TRAT1, TRIM22, TRIM23, TRIM25, TRIM40, TRIM58, TTYH2, TTYH3, TXK, TYMP, UBE2N, UNC93B1, USP18, XBP1, XCL1, XRCC5, YY1, ZBP1, ZBTB7A, ZC3HAV1, ZFP36L2, ZNF3",49.64,43.89,4.218317296884579e-96,95.37486075624581
BNT-I (D0-5),I (D0-4),0.442,434,197,352,631,786,"ABCA1, ABCA13, ABLIM1, ADAM9, ADAP2, ADAR, ADM, AGPAT3, AGTRAP, AIM2, ANKH, ANXA3, ANXA5, APEH, APLP2, APOBEC3A, APOBEC3F, ARHGEF10L, ARL4C, ASGR1, ASGR2, ASXL1, ATF3, ATP1B2, ATP8B4, AXL, BATF2, BAX, BCL11B, BLVRB, BPI, BRCA2, BRI3, BST1, BST2, BTK, C1QA, C1QB, C1QC, C1orf162, C2, C3, CACNB3, CACNB4, CALR, CAMP, CAPG, CARD9, CASP4, CCL2, CCL7, CCNB2, CCR6, CCR7, CCR9, CCRL2, CD177, CD1B, CD1C, CD274, CD28, CD300C, CD33, CD36, CD37, CD46, CD68, CD74, CD86, CDKN2B, CEACAM1, CEACAM8, CFB, CHAF1A, CHAF1B, CHIT1, CHRNB2, CLC, CLEC12B, CLPTM1, CNOT3, CR2, CRIM1, CSF1R, CSK, CST3, CST7, CTLA4, CTSB, CX3CR1, CXCL1, CXCL10, CXCL11, CXCL6, CXCR4, CYBA, CYBB, CYBRD1, CYFIP1, DAB2, DCAF15, DDX58, DDX60, DEFB1, DHCR24, DHX58, DHX9, DOCK4, DOK3, EDNRB, EFNB1, EIF2AK2, EIF2B2, ELOVL4, EMILIN2, ENPP1, EPB41L3, EPHB2, EPX, ESCO2, ETS1, EVI2B, F2, FAM20C, FAM46A, FAM69B, FCGR2C, FCN1, FES, FGR, FKBP14, FOXO1, FPR3, FUT7, FXYD6, FYB, FZD5, GAPT, GAS2L1, GBP1, GCH1, GHSR, GNAI1, GPBAR1, GPR183, GPR84, GPX1, GRAMD1C, GRINA, GRN, GSDMD, GTPBP1, H1FX, HERC5, HESX1, HK1, HK3, HLA-A, HLA-DOA, HLA-DQA1, HLA-F, HMGB1, HMOX1, HRH4, HS3ST3B1, HYAL2, IDO1, IFI27, IFI30, IFI35, IFI6, IFIH1, IFIT1, IFIT2, IFIT3, IFITM2, IFITM3, IL10, IL10RB, IL11, IL12RB1, IL15RA, IL17RC, IL18, IL1RN, IL2RB, IL4I1, IMPDH2, IQGAP3, IRAK1BP1, IRF2, IRF7, IRF9, ISG15, ITGA6, ITGAL, ITGAM, JAK1, JUNB, JUP, KDELR1, KIT, KLF12, KLF4, KLF5, KLRB1, LACC1, LAG3, LAIR1, LAMP3, LCN2, LCP2, LGALS1, LGALS9, LGR4, LHFPL2, LIF, LILRA6, LILRB1, LILRB2, LILRB4, LIMK1, LMBR1L, LRP1, LSM14A, LTBR, LTF, LYL1, MAP2K2, MAP2K6, MAPK1, MARCH1, MARCKS, MARCO, MASP2, MAZ, MCM7, MCTP1, MDK, MEF2A, MERTK, METTL3, MMP19, MMP8, MMP9, MNDA, MS4A14, MS4A4A, MS4A6A, MSR1, MST1R, MX1, MX2, MYD88, MYO1C, MYO1G, MYO7B, MYOF, NAGLU, NAIP, NCAPH2, NCF1, NCR3LG1, NF1, NFE2, NKAP, NLGN4Y, NOD2, OAS1, OAS2, OAS3, OASL, OLFM4, OLR1, OSCAR, P2RX5, P2RY6, PAFAH1B1, PARP9, PDCD1LG2, PDE4D, PDGFRB, PDIA3, PECAM1, PF4, PIK3AP1, PIK3CA, PIK3R1, PILRA, PKIA, PKMYT1, PLD3, PLEKHM2, PLSCR1, PLXNB2, PML, POU2F2, PPAP2B, PPIB, PPP1R16B, PRAM1, PRKCD, PRKCE, PRRG4, PSEN2, PSMB10, PSMB9, PTGDS, PTGFRN, PTH2R, PTPN6, PTPRCAP, RAB10, RAB3B, RAB6A, RAC2, RAMP1, RANBP1, RAPGEF3, RASSF4, RBBP8, RELB, RGL1, RGS1, RHOH, RIN2, RNASE2, RNF213, ROMO1, RORA, RPL13A, RPL22, RPL30, RPL39, RPS6, RSAD2, S100A11, S100A7, S100P, SAC3D1, SCARB2, SDC1, SECTM1, SERINC5, SERPINA1, SERPINB10, SERPING1, SGK1, SIGLEC1, SIGLEC16, SIGLEC5, SIGLEC7, SIRPB1, SLA, SLAMF1, SLC12A2, SLC16A3, SLC19A2, SLC1A3, SLC24A4, SLC26A7, SLC26A8, SLC27A3, SLC4A7, SLCO2B1, SLCO4C1, SMPD1, SORCS3, SORT1, SOS1, SP100, SP140, SP2, SPI1, SRC, ST14, STAB1, STAT1, STAT2, STXBP4, SUCNR1, TAP1, TAP2, TARM1, TAS2R10, TBC1D8, TBKBP1, TCN1, TFE3, TFEB, TFEC, TGFB1, THEM4, THEMIS, TICAM1, TIMP2, TLR5, TLR7, TMEM140, TMEM51, TNFRSF1B, TNFRSF9, TNFSF10, TNFSF13, TNFSF13B, TNFSF15, TNS3, TOP2B, TPD52, TRIM21, TRIM22, TRIM23, TRIM25, TRIM26, TRPC1, TSPAN2, TTYH2, TTYH3, TUBB4B, TUBG1, TYMP, TYROBP, UBA7, UNC93B1, USP18, VAV2, XCL1, XRCC6, YY1, ZBP1, ZBTB7A, ZC3HAV1, ZFP36L2, ZNF3",68.78,55.22,2.9484300728324615e-44,43.53040916781601
